10,08,2002,14,08,2002,Iran (Islamic Republic of),IRN,"Golestan, Khorasan, Semnan provinces",,,9720,Km2,Flood,Riverine flood,--,--,39,200000,4000,0,"",2002-0500,IR,"Iran, Islamic Rep.",,,,,,,1507.69801241965,128626917503.717,,,,138364,67983330,,,
26,03,2003,27,03,2003,Iran (Islamic Republic of),IRN,Esfahan province,,,3000,Km2,Flood,Riverine flood,--,--,0,1370,838,0,"",2003-0232,IR,"Iran, Islamic Rep.",,,,,,,1759.55241702596,153544751395.431,,,,122530,68812713,,,
10,01,2004,19,01,2004,Iran (Islamic Republic of),IRN,"Firuzabad, Lamerd, Darab, Abadeh, Bavanat, Mamasani districts (Fars Province), Bushehr, Kohgiluyeh va boyerahma provinces",,,,Km2,Flood,Flash flood,Broken Dam/Burst bank,--,6,10,0,0,"",2004-0012,IR,"Iran, Islamic Rep.",,,,,,,2138.29662482552,190043433964.846,,,,115162,69617100,,,
09,12,2004,28,12,2004,Iran (Islamic Republic of),IRN,"Kalameh village (Dashtestan district, Bushehr province), Assalouyeh city (Kangan district, Bushehr province), Sarbaz city (Iranshahr district, Sistan-o baluchestan province), Tangestan district (Bushehr province), Bandar-e abbas district (Hormozgan province), Sirjan district (Kerman province)",,,436700,Km2,Flood,Flash flood,--,--,34,4043,0,0,"",2004-0626,IR,"Iran, Islamic Rep.",,,,,,,2138.29662482552,190043433964.846,,,,115162,69617100,,,
11,03,2005,12,03,2005,Iran (Islamic Republic of),IRN,Lorestan province,,,23040,Km2,Flood,Riverine flood,"Slide (land, mud, snow, rock)",--,3,3000,0,0,"",2005-0113,IR,"Iran, Islamic Rep.",,,,,,,2500.02891462544,226452138291.545,43.6,,,99428,70421811,,28,
31,07,2005,01,08,2005,Iran (Islamic Republic of),IRN,"Kalaleh city (Minudasht district, Golestan province)",,,4580,Km2,Flood,Riverine flood,--,--,52,0,0,0,"",2005-0414,IR,"Iran, Islamic Rep.",,,,,,,2500.02891462544,226452138291.545,43.6,,,99428,70421811,,28,
09,08,2005,11,08,2005,Iran (Islamic Republic of),IRN,"Kalaleh city (Minudasht district, Golestan province)",,,4900,Km2,Flood,Riverine flood,--,--,43,1750,0,0,"",2005-0426,IR,"Iran, Islamic Rep.",,,,,,,2500.02891462544,226452138291.545,43.6,,,99428,70421811,,28,
15,08,2005,15,08,2005,Iran (Islamic Republic of),IRN,Mazandaran province,,,,Km2,Flood,--,--,--,11,0,0,0,"",2005-0436,IR,"Iran, Islamic Rep.",,,,,,,2500.02891462544,226452138291.545,43.6,,,99428,70421811,,28,
08,05,2006,13,05,2006,Iran (Islamic Republic of),IRN,Ardebil province,38.69,47.88,18310,Km2,Flood,Riverine flood,--,--,14,2800,16000,0,"",2006-0245,IR,"Iran, Islamic Rep.",,,,,,,2873.35197243366,266298911661.142,44.8,,,102483,71227880,,52,
27,06,2007,29,06,2007,Iran (Islamic Republic of),IRN,"Kashan, Qohrud, Jarinan areas (Kashan districts, Esfahan province)",33.75,52.2,11600,Km2,Flood,Flash flood,--,--,12,0,22000,0,"",2007-0242,IR,"Iran, Islamic Rep.",,,,,,,3824.60942815129,349881601458.559,,,,68397,72031103,,72,
09,09,2008,10,09,2008,Iran (Islamic Republic of),IRN,"Farsan, Ardel districts (Chaharmahal-o bakhtiyar province)",53.26,-1.8,,Km2,Flood,Riverine flood,--,--,19,200,0,0,"",2008-0380,IR,"Iran, Islamic Rep.",,,,,,,4308.47724025694,406070949553.87,,,,69061,72845542,,117,
07,08,2008,08,08,2008,Iran (Islamic Republic of),IRN,Maku district (West Azarbayejan province),39.24,44.69,7096,Km2,Flood,Riverine flood,--,--,3,1280,0,0,"",2008-0417,IR,"Iran, Islamic Rep.",,,,,,,4308.47724025694,406070949553.87,,,,69061,72845542,,117,
12,10,2012,15,10,2012,Iran (Islamic Republic of),IRN,"Behshahr, Sari, Gaemshahr, Babol districts (Mazandaran province)",36.53,54.26,11490,Km2,Flood,Riverine flood,--,--,7,1000,0,0,"",2012-0471,IR,"Iran, Islamic Rep.",,,,,,,6214.78334505708,598853401276.104,,,,75940,76453574,,,
01,06,2014,10,06,2014,Iran (Islamic Republic of),IRN,"Khorasan,  Mazandaran, Semnan, Golestan provinces",,,305525,Km2,Flood,--,"Slide (land, mud, snow, rock)",--,37,440000,49000,0,"",2014-0171,IR,"Iran, Islamic Rep.",,,,,,,4247.95155058976,434474616831.914,38.8,,,82191,78411092,,,
10,03,2015,11,03,2015,Iran (Islamic Republic of),IRN,Bandar-e Abbas district (Hormozgan province),,,,Km2,Flood,Flash flood,--,--,3,2000,60000,0,"",2015-0088,IR,"Iran, Islamic Rep.",,,,,,,3775.73909536383,385874474398.59,,,,84950,79360487,,,
11,03,2015,15,03,2015,Iran (Islamic Republic of),IRN,"Hormozgan, Kerman, Sistan-o baluchestan provinces",,,,Km2,Flood,Flash flood,Lightening,--,3,2700,60000,0,"",2015-0127,IR,"Iran, Islamic Rep.",,,,,,,3775.73909536383,385874474398.59,,,,84950,79360487,,,
14,07,2015,21,07,2015,Iran (Islamic Republic of),IRN,"Tehran, Mazandaran, Ghazvin, Khorasan, Kordestan, Kerman, Semnan, Zanjan, West Azarbayejan provinces",33.6304,54.04,776608.03,Km2,Flood,Flash flood,--,--,23,4030,0,0,"",2015-0258,IR,"Iran, Islamic Rep.",,,,,,,3775.73909536383,385874474398.59,,,,84950,79360487,,,
18,09,2015,18,09,2015,Iran (Islamic Republic of),IRN,"Pakdasht district (Tehran province), Hormozgan province",,,,Km2,Flood,--,--,--,14,0,0,0,"",2015-0438,IR,"Iran, Islamic Rep.",,,,,,,3775.73909536383,385874474398.59,,,,84950,79360487,,,
12,11,2015,12,11,2015,Iran (Islamic Republic of),IRN,"Tudan district (Hormozgan province), Fars, Kerman provinces",,,,Km2,Flood,Flash flood,--,--,9,17700,516000,0,"",2015-0499,IR,"Iran, Islamic Rep.",,,,,,,3775.73909536383,385874474398.59,,,,84950,79360487,,,
15,04,2017,16,04,2017,Iran (Islamic Republic of),IRN,"Azerbaijane-Gharbi (west), Azerbaijane-Sharghi (east), Kordestan, Zanjan, Mazandaran, Ardebil",37.704,46.169,40807.87,Km2,Flood,Flash flood,"Slide (land, mud, snow, rock)",--,42,0,353000,0,"",2017-0096,IR,"Iran, Islamic Rep.",,,,,,,,439513511620.591,,,,118595,81162788,,27,
10,08,2017,15,08,2017,Iran (Islamic Republic of),IRN,"Golestan, Khorazan, Khorazan Razavi provinces; Ilam, Semnan",,,,Km2,Flood,Flash flood,--,--,18,2000,35000,0,"",2017-0472,IR,"Iran, Islamic Rep.",,,,,,,,439513511620.591,,,,118595,81162788,,27,
10,01,2004,19,01,2004,Iraq,IRQ,"Marshland area (Nassriya district, Thi-Qar province)",,,,Km2,Flood,Flash flood,--,--,0,8000,0,0,"",2004-0012,IQ,Iraq,,,,,,,1015.2520859284,36627901762.063,,,,311884,26316609,,4094,
04,02,2006,12,02,2006,Iraq,IRQ,"Erbil, Salah al-Din, Kirkuk, Diyala, Missan provinces",34.21,45.49,77640,Km2,Flood,Riverine flood,--,--,0,41890,1300,0,"",2006-0065,IQ,Iraq,,,,,,,1807.13062541957,65140293687.5395,28.6,,,1450905,27697912,,3939,
05,11,2006,07,11,2006,Iraq,IRQ,"Khalifan city (Soran district, Erbil province)",36.23,44.81,19960,Km2,Flood,Flash flood,--,--,20,18020,0,0,"",2006-0599,IQ,Iraq,,,,,,,1807.13062541957,65140293687.5395,28.6,,,1450905,27697912,,3939,
10,09,2008,11,09,2008,Iraq,IRQ,"Choman district (Erbil province), Pshdar district (Sulaymaniah province)",36.16,45.11,3310,Km2,Flood,Riverine flood,--,--,4,600,0,0,"",2008-0523,IQ,Iraq,,,,,,,3669.26831037864,131613661510.475,,,,1903519,29111417,,2200,
30,10,2009,02,11,2009,Iraq,IRQ,"Mergasur, Choman, Soran districts (Erbil province)
Sumel district (Dahuk province)",,,,Km2,Flood,Flash flood,"Slide (land, mud, snow, rock)",--,2,3000,0,0,"",2009-0489,IQ,Iraq,,,,,0.0148379593241009,,3104.02861690032,111660855042.735,,,,1785212,29894652,,1043,2764000
22,04,2011,22,04,2011,Iraq,IRQ,"Mosul district (Ninewa province), Erbil, Sulaymaniyah, Kirkuk, Dahuk, Kerbala, Salah al-Din provinces",,,,Km2,Flood,Flash flood,--,--,6,2001,0,0,"",2011-0184,IQ,Iraq,,,,,,,4438.85077455284,185749664444.444,,,,1428308,31727053,,1072,2600000
25,12,2012,26,12,2012,Iraq,IRQ,Baghdad province,,,,Km2,Flood,Riverine flood,--,--,4,0,0,0,"",2012-0491,IQ,Iraq,,,,,,,5188.88328031514,218000986222.639,29.5,,,746206,32776571,,638,2100000
18,11,2013,19,11,2013,Iraq,IRQ,"Nassriya district (Thi-Qar province), Diwaniya district (Qadissiya province), Hilla district (Babil province), Baghdad province",,,,Km2,Flood,Riverine flood,--,--,11,0,0,0,"",2013-0504,IQ,Iraq,,,,,,,5436.32715934955,234648370497.427,,,,401466,33883145,,1882,2100000
28,10,2015,30,10,2015,Iraq,IRQ,"Baghdad, Wassit provinces",,,,Km2,Flood,Flash flood,--,--,58,65000,0,0,"",2015-0485,IQ,Iraq,,,,,,,3871.77442812693,179640210726.448,,,,264094,36115649,,10138,3290000
14,11,2002,25,11,2002,Ireland,IRL,"Kildare, Waterford, Wicklow provinces; Dunboyne, Clonee cities (Meath province), Blackwater, Gorey cities (Wexford province), Blanchardstown, Dublin, Mulhuddart cities (Dublin province)",,,0,Km2,Flood,Riverine flood,--,--,0,300,0,0,"",2002-0773,IE,Ireland,,,,,,,23482.6930108411,127945379258.423,,,,7,3931947,,,
18,11,2009,20,11,2009,Ireland,IRL,"Cork, Galway, Tipperary, Kilkenny, Carlow, Kerry, Leitrim, Clare, Sligo, Waterford provinces",,,,Km2,Flood,Riverine flood,--,--,0,0,0,0,"",2009-0497,IE,Ireland,,,,,0.00490736939920962,,35703.5688530576,236311336482.356,32.7,,,7,4535375,,,
25,10,2011,25,10,2011,Ireland,IRL,"Dublin city (Dublin province), Kilbride village (Wicklow province)",,,,Km2,Flood,Riverine flood,--,--,2,600,325000,165000,"",2011-0453,IE,Ireland,,,,,,,34634.8948426952,239018536581.675,32.9,,,8,4580084,,,
22,11,2017,23,11,2017,Ireland,IRL,Mountmellick (Laois),,,,Km2,Flood,--,--,--,0,300,0,0,"",2017-0490,IE,Ireland,,,,,,,,333730764773.18,,,,,4813608,,,
19,01,2010,19,01,2010,Israel,ISR,Southern District province,,,,Km2,Flood,Riverine flood,Lightening,--,2,0,0,0,"",2010-0021,IL,Israel,,,,,,,25869.259835642,233609522091.468,42.6,,,1301,7623600,,27,
24,04,2018,27,04,2018,Israel,ISR,Nahal Tsafit gorges,31.164,34.861,17900.1,Km2,Flood,Flash flood,--,--,12,0,0,0,"",2018-0128,,,,,,,,,,,,,,,,,,
10,09,2000,10,09,2000,Italy,ITA,"Soverato town (Catanzaro district, Calabria province)",,,,Km2,Flood,Riverine flood,--,--,16,22,0,0,"",2000-0577,IT,Italy,,,,,,,17009.3628586802,1141759996314.72,,,,48,56942108,,,
20,09,2000,20,09,2000,Italy,ITA,"Lodrone city (Trento district, Trentino-alto Adige province), Veneto province",,,,Km2,Flood,--,--,--,0,1000,0,0,"",2000-0632,IT,Italy,,,,,,,17009.3628586802,1141759996314.72,,,,48,56942108,,,
14,10,2000,22,10,2000,Italy,ITA,"San Rocco al Porto, Salerano towns (Lodi district, Lombardia province)
Torino, Chivasso, Ivrea, Banchette, Orco, Soana, Noasca, Ronco Canavese towns (Torino district, Piemonte province), Pavia town (Pavia district, Lombardia province), Cremona town (Cremona district, Lombardia province), Parma town (Parma district, Emilia-romagna province), Piacenza town (Piacenza district, Emilia-romagna province), Aosta, Dora di Aoste, Pollein town (Aosta district, Valle D'aosta province), San Benedetto Po, Borgoforte townd (Mantova district, Lombardia province), Casale Popolo town (Alessandria district, Piemonte province), Fiorano town (Modena district, Emilia-romagna province), Monterosso town (La Spezia district, Liguria province), Genova town (Genova district, Liguria province), Verbania district (Piemonte province)",,,,Km2,Flood,Flash flood,--,--,25,43000,8000000,300000,"",2000-0671,IT,Italy,,,,,,,17009.3628586802,1141759996314.72,,,,48,56942108,,,
20,11,2000,20,11,2000,Italy,ITA,"Lombardoa province, Friuli-venezia province, Venezia district (Veneto province), Rovere della Luna town (Trento district, Trentino-alto Adige province), Vinchiana town (Lucca district, Toscana province)",,,,Km2,Flood,--,--,--,5,2000,50000,0,"",2000-0752,IT,Italy,,,,,,,17009.3628586802,1141759996314.72,,,,48,56942108,,,
"",01,2001,"",01,2001,Italy,ITA,Venezia district (Veneto province),,,,Km2,Flood,Riverine flood,--,--,0,0,0,0,"",2001-0016,IT,Italy,,,,,,,17308.5258744313,1162317852348.99,,,,34,56974100,,,
14,09,2001,15,09,2001,Italy,ITA,Napoli district (Campania province),,,69,Km2,Flood,Flash flood,--,--,2,0,100000,0,"",2001-0536,IT,Italy,,,,,,,17308.5258744313,1162317852348.99,,,,34,56974100,,,
06,06,2002,09,06,2002,Italy,ITA,"Frioul-venezia Giulia province, Valle d'aosta province, Villanova town (Biella district, Piemonte province), Venezia town (Venezia district, Veneto province)",,,,Km2,Flood,Flash flood,"Slide (land, mud, snow, rock)",--,0,0,0,0,"",2002-0343,IT,Italy,,,,,,,18726.8562883956,1266510634293.24,,,,224,57059007,,,
04,08,2002,14,08,2002,Italy,ITA,"Brescia district (Lombardia province), Venezia district (Veneto province)",,,,Km2,Flood,--,--,--,0,20,296000,10000,"",2002-0472,IT,Italy,,,,,,,18726.8562883956,1266510634293.24,,,,224,57059007,,,
22,11,2002,03,12,2002,Italy,ITA,"Trentino-alto Adige province, Genova district (Liguria province), Milano, Mantova, Como, Varese districts (Lombardia province), Torino, Biella, Verbania districts (Piemonte province), Venezia district (Veneto province), Trieste, Pordedone districts (Friuli-venezia Giulia province), Bologna district (Emilia-romagna province). ",,,29900,Km2,Flood,Riverine flood,"Slide (land, mud, snow, rock)",--,2,10000,350000,20000,"",2002-0740,IT,Italy,,,,,,,18726.8562883956,1266510634293.24,,,,224,57059007,,,
25,01,2003,27,01,2003,Italy,ITA,"Pescara, Chieti districts (Abruzzi province), Foggia district (Puglia province),  Potenza district (Basilicata province), Agnone, Bagnoli del Trigno towns (Isernia district, Molisse province), Termoli, Lupara, Petacciato, Fossalto, Mafalda, San Giacomo degli Schiavoni,Santa Croce di Magliano, Tavenna, Toro et Trivento (Campobasso district, Molisse province)",,,28760,Km2,Flood,Riverine flood,"Slide (land, mud, snow, rock)",--,1,1000,150000,100000,"",2003-0043,IT,Italy,,,,,,,23084.7571438194,1569649661399.55,34.9,,,207,57313203,,,
29,08,2003,31,08,2003,Italy,ITA,"Ugovizza village (Udine district, Friuli-venezia Giulia)",,,1100,Km2,Flood,Riverine flood,"Slide (land, mud, snow, rock)",Flood,2,350,655000,0,"",2003-0433,IT,Italy,,,,,,,23084.7571438194,1569649661399.55,34.9,,,207,57313203,,,
29,05,2008,30,05,2008,Italy,ITA,"Savigliano, Demonte towns (Cuneo district, Piemonte province), Torino district (Piemonte province), Chambave towns (Aosta district, Valle d'aosta province)",,,,Km2,Flood,Riverine flood,"Slide (land, mud, snow, rock)",--,4,0,0,0,"",2008-0216,IT,Italy,,,,,,,33620.5258511291,2390729163615.06,33.8,,,62,58826731,,,
12,07,2008,12,07,2008,Italy,ITA,"Milano, Como, Lecco, Sondrio districts (Lombardia province)",,,,Km2,Flood,--,"Slide (land, mud, snow, rock)",--,2,300,0,0,"",2008-0420,IT,Italy,,,,,,,33620.5258511291,2390729163615.06,33.8,,,62,58826731,,,
11,12,2008,15,12,2008,Italy,ITA,"Roma district (Lazio province), Venezia district (Veneto province)",41.83,13.16,5425,Km2,Flood,Riverine flood,Rain,--,3,0,278000,0,"",2008-0579,IT,Italy,,,,,,,33620.5258511291,2390729163615.06,33.8,,,62,58826731,,,
01,10,2009,06,10,2009,Italy,ITA,"Giampilieri, Taormina, Scaletta Zanclea, Molino towns (Messina district, Sicilia town)",38.11,15.73,1227,Km2,Flood,Riverine flood,"Slide (land, mud, snow, rock)",--,35,5140,20000,0,"",2009-0428,IT,Italy,,,,,0.00710221906895916,,30570.7232370613,2185160183384.27,33.8,,,45,59095365,,,
08,11,2010,11,11,2010,Italy,ITA,"Salerno district (Campania provine), Venezia district (Veneto province)",45.13,11.14,18725,Km2,Flood,Riverine flood,--,--,0,300,0,0,"",2010-0582,IT,Italy,,,,,,,29492.912652899,2125058244242.92,34.7,,,50,59277417,,,
26,10,2011,26,10,2011,Italy,ITA,"Cinque Terre, Borghetto Vara towns (La Spezia district, Liguria province), Aulla, Mullazo towns (Massa-carrara district, Toscana province)",44.422,9.33,,Km2,Flood,Flash flood,"Slide (land, mud, snow, rock)",--,10,0,545000,14000,"",2011-0416,IT,Italy,,,,3.5,,,31407.048484923,2276292404600.52,35.1,,,58,59379449,,,
04,11,2011,06,11,2011,Italy,ITA,"Genova district (Liguria province), Matera district (Basilicate province), Napoli district (Campania province); Guspini town (Cagliari district, Sardegna province); Alessandria, Torino districts (Piemonte province)",,,,Km2,Flood,Flash flood,--,--,6,0,0,0,"",2011-0436,IT,Italy,,,,3.5,,,31407.048484923,2276292404600.52,35.1,,,58,59379449,,,
11,11,2012,18,11,2012,Italy,ITA,"Massa-carrara, Pisa, Livorno, Siena districts (Toscana province)
Capalbio, Albinia, Orbetello towns (Grossetto district, Toscana province), Orvieto town (Terni district, Umbria province), Venezia district (Veneto province), Roma district (Lazio province)",43.1605,12.41,,Km2,Flood,Riverine flood,--,--,4,1200,15000,0,"",2012-0466,IT,Italy,,,,,,,28352.8533312782,2072823157059.76,35.2,,,66,59539717,,,
18,11,2013,19,11,2013,Italy,ITA," Olbia, Arzachena cities (Sassari district, Sardegna province)",40.3,9.01,15699,Km2,Flood,Riverine flood,--,--,18,2700,780000,0,"",2013-0441,IT,Italy,,,,,,,28757.9864880275,2130491320658.68,34.9,,,66,60233948,,,
18,01,2014,31,01,2014,Italy,ITA,"Bastiglia, Carpi, Medolla, Mirandoli cities (Modena district, Emilia-romagna province), Genova, La Spezia districts (Liguria province), Pisa, Volterra cities (Pisa district, Toscana province), Bologna district (Emilia-romagna province)",43.9958,7.1,,Km2,Flood,Flash flood,"Slide (land, mud, snow, rock)",--,2,1601,120000,0,"",2014-0026,IT,Italy,,,,,,,28897.5816287483,2151732868243.21,34.7,,,67,60789140,,,
31,01,2014,01,02,2014,Italy,ITA,"Ponsacco, San Miniato towns (Pisa district, Toscane province); Roma, Ostie, Fiumicino towns (Roma district, Lazio province), Noto town (Siracusa district, Sicila province), Catania, Messina districts (Sicilia province), Monasterace town (Reggio Calabria district, Calabria province), Frosinone district (Lazio province).",,,,Km2,Flood,Riverine flood,"Slide (land, mud, snow, rock)",--,4,0,294000,0,"",2014-0045,IT,Italy,,,,,,,28897.5816287483,2151732868243.21,34.7,,,67,60789140,,,
02,05,2014,10,05,2014,Italy,ITA,"Senigallia, Chiaravalle towns (Ancona district, Marche province)",,,11256,Km2,Flood,Flash flood,--,--,3,8010,120000,0,"",2014-0252,IT,Italy,,,,,,,28897.5816287483,2151732868243.21,34.7,,,67,60789140,,,
08,10,2014,11,10,2014,Italy,ITA,"Genova district (Liguria province), Torino district (Piemonte province), Parma district (Emilia-romagna province), Padova district (Veneto province), Brescia district (Lombardia province)",,,,Km2,Flood,Flash flood,"Slide (land, mud, snow, rock)",--,1,0,303000,0,"",2014-0448,IT,Italy,,,,,,,28897.5816287483,2151732868243.21,34.7,,,67,60789140,,,
14,10,2015,16,10,2015,Italy,ITA,"L'Aquila district (Abruzzi province), Tivoli city (Roma district, Lazio province), Frosinone district (Lazio province); Benevento (Campania region); Palermo, Messina, Trapani districts (Sicilia province)",,,,Km2,Flood,Flash flood,"Slide (land, mud, snow, rock)",--,4,50,163000,0,"",2015-0465,IT,Italy,,,,,,,24539.2727553408,1832868490534.11,35.4,,,70,60730582,,,
01,11,2015,13,11,2015,Italy,ITA,"Reggio Calabria, Catanzaro districts (Calabria province); Messina, Catania districts (Sicilia province)",,,,Km2,Flood,Flash flood,--,--,2,0,0,0,"",2015-0532,IT,Italy,,,,,,,24539.2727553408,1832868490534.11,35.4,,,70,60730582,,,
11,08,2015,12,08,2015,Italy,ITA,"Corigiano Calabro, Rossano Calabro (Cosenza province, Calabria)",,,,Km2,Flood,Flash flood,--,--,0,500,111000,0,"",2015-0598,IT,Italy,,,,,,,24539.2727553408,1832868490534.11,35.4,,,70,60730582,,,
23,11,2016,25,11,2016,Italy,ITA,"Piémont, Liguria provinces",,,,Km2,Flood,Riverine flood,--,--,2,400,100000,0,"",2016-0453,IT,Italy,,,,,,,25262.3846120397,1859383610248.72,,,,51,60627498,,,
11,12,2017,12,12,2017,Italy,ITA,"Emilia Romagna (between Sorbolo and Boretto (Parma, Reggio Emilia), Lentigione village, Brescello, Colorno), Tuscany (Lucca)",45.457,105.881,27560.36,Km2,Flood,Riverine flood,--,--,0,1000,125000,48000,"",2017-0544,IT,Italy,,,,,,,,1934797937411.33,,,,47,60551416,,,
21,08,2018,21,08,2018,Italy,ITA,Calabre,,,,Km2,Flood,Flash flood,--,--,10,23,0,0,"",2018-0308,,,,,,,,,,,,,,,,,,
23,05,2002,05,06,2002,Jamaica,JAM,"Manchester, Saint Andrew And Kingston, Clarendon, Saint Catherine, Saint Thomas, Saint Ann, Portland, Saint Elizabeth provinces",,,,Km2,Flood,Riverine flood,"Slide (land, mud, snow, rock)",--,9,25000,20000,0,"",2002-0325,JM,Jamaica,,,,,,,3091.2709560573,9694169756.90153,48.3,,,147,2695446,,,
22,11,2006,26,11,2006,Jamaica,JAM,"Saint Ann, Saint Mary, Portland provinces",,,,Km2,Flood,Riverine flood,"Slide (land, mud, snow, rock)",--,1,5000,0,0,"",2006-0656,JM,Jamaica,,,,,,,3734.58008156107,11905525197.3285,,,,660,2760279,,,
28,06,1999,30,06,1999,Japan,JPN,"Kobe, Nagasaki, Fukuoka (Hiroshima State)",,,,Km2,Flood,Riverine flood,--,--,45,24139,107000,0,"",1999-0243,JP,Japan,,,,,,,28319.9109646907,4562078822335.45,,,,3,126631000,,,
14,08,1999,14,08,1999,Japan,JPN,Tokyo,,,,Km2,Flood,Riverine flood,--,--,15,0,0,0,"",1999-0356,JP,Japan,,,,,,,28319.9109646907,4562078822335.45,,,,3,126631000,,,
10,09,2000,17,09,2000,Japan,JPN,"Aiti, Sizuoka, Mie, Gifu provinces",,,,Km2,Flood,Coastal flood,"Slide (land, mud, snow, rock)",--,18,360110,7440000,990000,"",2000-0606,JP,Japan,,,,,,,30451.6432673284,4887519660744.86,,,,5,126843000,,,
"",06,2001,"",06,2001,Japan,JPN,"Matuyamasi district (Ehime province), Iidukasi district (Hukuoka province)",,,,Km2,Flood,--,--,--,1,138,0,0,"",2001-0350,JP,Japan,,,,,,,26772.4422537035,4303544259842.72,,,,5,127149000,,,
19,07,2003,21,07,2003,Japan,JPN,"Minamata district (Kumamoto province), Hisikarityoo district (Kagosima province), Kinkaityoo district (Nagasaki province)",,,8080,Km2,Flood,Riverine flood,"Slide (land, mud, snow, rock)",--,23,814,7000,0,"",2003-0343,JP,Japan,,,,,,,27559.5367012936,4445658071221.86,,,,19,127718000,,,
12,07,2004,14,07,2004,Japan,JPN,"Niigata, Hukusima provinces",,,7060,Km2,Flood,Flash flood,"Slide (land, mud, snow, rock)",--,21,25807,1950000,279000,"",2004-0339,JP,Japan,,,,,,,30039.1657003114,4815148854362.11,,,,21,127761000,,,
11,11,2004,12,11,2004,Japan,JPN,Sizuoka province,,,,Km2,Flood,Riverine flood,--,--,1,2290,0,0,"",2004-0563,JP,Japan,,,,,,,30039.1657003114,4815148854362.11,,,,21,127761000,,,
28,06,2005,28,06,2005,Japan,JPN,Niigata province,,,,Km2,Flood,Riverine flood,--,--,0,900,0,0,"",2005-0394,JP,Japan,,,,,,,29741.0208209422,4755410630912.14,,,,13,127773000,,,
19,06,2006,20,07,2006,Japan,JPN,"Matumotosi, Okayasi, Minowamati districts (Nagano province), Izumosi district (Simane province), Aminotyoo, Kumihamatyoo, Oomiyatyoo, Tangotyoo, Yasakatyoo districts (Kyooto province), Tateyamamati district (Toyama province) ",35.34,136.22,47890,Km2,Flood,Riverine flood,"Slide (land, mud, snow, rock)",--,34,6232,0,0,"",2006-0378,JP,Japan,,,,,,,28339.6277123127,4530377224970.4,,,,168,127854000,,,
22,07,2006,26,07,2006,Japan,JPN,"Akunesi district (Kagoshima province), Minamatasi district (Kumamoto province)",31.54,130.99,6130,Km2,Flood,Riverine flood,"Slide (land, mud, snow, rock)",--,8,4300,0,0,"",2006-0390,JP,Japan,,,,,,,28339.6277123127,4530377224970.4,,,,168,127854000,,,
04,07,2007,12,07,2007,Japan,JPN,"Ehime, Hukuoka, Kagawa, Kagosima, Kooti, Kumamoto, Miyazaki, Nagasaki, Ooita, Saga, Tokusima provinces",,,2670,Km2,Flood,Riverine flood,"Slide (land, mud, snow, rock)",--,2,10000,0,0,"",2007-0319,JP,Japan,,,,,,,28276.0039058089,4515264514430.57,,,,521,128001000,,,
28,07,2008,29,07,2008,Japan,JPN,"Koobesi_Higasinadaku, Koobesi_Hyoogoku, Koobesi_Kitaku, Koobesi_Nadaku, Koobesi_Nagataku, Koobesi_Nisiku, Koobesi_Sumaku, Koobesi_Tarumiku, Koobesi_Tyuuooku districts (Hyoogo province),
Kanazawasi district (Isikawa province)",35.88,136.38,52420,Km2,Flood,Riverine flood,--,--,5,50003,0,0,"",2008-0293,JP,Japan,,,,,,,30965.2112073782,5037908465114.48,32.1,,,185,128063000,,,
18,07,2010,18,07,2010,Japan,JPN,"Gifu, Simane, Hirosima provinces",,,,Km2,Flood,Riverine flood,--,--,10,0,0,0,"",2010-0311,JP,Japan,,,,,,,35066.9235442206,5700098114744.41,,,,152,128070000,,,
29,07,2011,31,07,2011,Japan,JPN,"Yasudamati, Kamosi districts (Niigata province), Hukusima province",,,,Km2,Flood,--,Broken Dam/Burst bank,"Slide (land, mud, snow, rock)",6,2000,0,0,"",2011-0663,JP,Japan,,,,4.5,,,38101.7827216772,6157459594823.72,,,,176,127833000,,,
12,07,2012,13,07,2012,Japan,JPN,"Kumamoto, Ooita provinces",,,,Km2,Flood,Riverine flood,"Slide (land, mud, snow, rock)",--,30,48135,1400000,0,"",2012-0195,JP,Japan,,,,,,,38602.8686125989,6203213121334.12,,,,172,127629000,,,
28,07,2013,28,07,2013,Japan,JPN,"Simane, Yamaguti provinces",,,,Km2,Flood,Riverine flood,"Slide (land, mud, snow, rock)",--,5,3633,2000,0,"",2013-0265,JP,Japan,,,,,,,32487.2000952618,5155717056270.83,,,,157,127445000,,,
09,09,2015,11,09,2015,Japan,JPN,"Joso city (Mitukaidoosi district, Ibaraki province), Miyagi, Totigi provinces",,,,Km2,Flood,Riverine flood,"Slide (land, mud, snow, rock)",--,21,45046,1400000,650000,"",2015-0418,JP,Japan,,,,,,,28061.824295318,4394977752877.82,,,,145,127141000,,,
20,06,2016,23,06,2016,Japan,JPN,Kumamoto province,326.031,130.99,18480.56,Km2,Flood,--,"Slide (land, mud, snow, rock)",--,7,6000,0,0,"",2016-0221,JP,Japan,,,,,,,31117.7990144095,4949273341993.88,,,,59,126994511,,,
06,07,2017,07,07,2017,Japan,JPN,"Fukuoka (Asakura), Oita prefectures (Kyushu Isl.), Shimane, Kunamoto, Hiroshima, Nagasaki, Miyazaki, Kagoshima",,,,Km2,Flood,Riverine flood,"Slide (land, mud, snow, rock)",--,37,2944,700000,140000,"",2017-0246,JP,Japan,,,,,,,,4872136945507.59,,,,44,126785797,,,
29,06,2018,08,07,2018,Japan,JPN,"Kochi, Gifu,Nagano prefectures, Tokushima; Okayama, Hiroshima",35.65,137.895,109672.31,Km2,Flood,--,"Slide (land, mud, snow, rock)",--,220,1500000,0,0,"",2018-0190,,,,,,,,,,,,,,,,,,
"",04,2000,"",04,2000,Kazakhstan,KAZ,"Denisovskiy, Zhitikara, Taran, Qostanay districts (Kustanayskaya province)",,,108,Km2,Flood,--,--,--,0,2500,1500,0,"",2000-0235,KZ,Kazakhstan,,,,,,,734.978526848901,18291990619.137,,,,2537,14883626,,,
13,05,2001,13,05,2001,Kazakhstan,KAZ,"Glubokovskiy, Ulan districts (Vostochno-kazachstanskaya province)",,,,Km2,Flood,--,--,--,0,3668,0,0,"",2001-0774,KZ,Kazakhstan,,,,,,,991.095536047707,22152694161.8882,36,,,2803,14858335,,,
24,02,2005,23,03,2005,Kazakhstan,KAZ,Kyzylordinskaya province,,,,Km2,Flood,Flash flood,--,--,0,25000,7662,0,"",2005-0116,KZ,Kazakhstan,,,,,,,2131.93060061997,57123671733.8953,39.9,,,4316,15147029,,,
20,02,2008,03,03,2008,Kazakhstan,KAZ,"Saryaghash, Ordabasy, Arys, Shymkent City area, Shardara districts (Yujno-kazachstanskaya province), Kyzylordinskaya province",42.3,68.55,51580,Km2,Flood,Riverine flood,--,--,1,13000,130000,0,"",2008-0095,KZ,Kazakhstan,,,,,,,5286.99490842633,133441612246.798,28.5,,,4825,15674000,,,
