08,08,2017,09,08,2017,China,CHN,"Gansu, Jilin, Liaoning, Heilongjiang, Shandong, Henan, Hubei, Sichuan (Chengdu, Luzhou, and Deyang) provinces",,,,Km2,Flood,--,--,--,40,45000,315000,0,"",2017-0372,CN,China,,,,,,,,12237700479375,,,,207691,1386395000,,,
24,09,2017,07,10,2017,China,CHN,"Loess Plateau, Southern Shaanxi (Xianyang, Hanzhong, Ankang), western Hubei (Suizhou and Guangshui cities), southern Sichuan, northern portions of Chongqing (Kaizhou, Yunyang)",29.612,113.645,283444.21,Km2,Flood,--,--,--,16,61500,361000,0,"",2017-0398,CN,China,,,,,,,,12237700479375,,,,207691,1386395000,,,
01,10,2017,10,10,2017,China,CHN,"Chongqing (Wanzhou, Beibei, Liangping), Henan (Jiazuo, Nanyang, Zhoukou), Hubei (Shiyan, Yichang), Shaanxi (Xianyang, Weinan, Ankang, Xian), Sichuan (Panzhihua), Anhui (Suzhou)",,,,Km2,Flood,--,Storm,--,23,15600,75000,0,"",2017-0463,CN,China,,,,,,,,12237700479375,,,,207691,1386395000,,,
11,08,2017,16,08,2017,China,CHN,"Chongqing, Guangxi Zhuang, Guizhou, Henan, Hubei, Hunan, Jiangxi, and Yunnan",,,,Km2,Flood,--,--,--,18,37800,429000,0,"",2017-0476,CN,China,,,,,,,,12237700479375,,,,207691,1386395000,,,
26,04,2017,29,04,2017,China,CHN,Yulin city (Shaanxi province),,,,Km2,Flood,--,--,--,8,76800,492000,0,"",2017-0568,CN,China,,,,,,,,12237700479375,,,,207691,1386395000,,,
05,07,2018,07,07,2018,China,CHN,"Sichuan, Gansu, Chongqing, Hubei, Jiangsu, Guizhou, Anhui, Shaanxi, Henan, Fujian",,,,Km2,Flood,--,Storm,--,108,450000,1300000,0,"",2018-0198,,,,,,,,,,,,,,,,,,
07,05,2018,30,05,2018,China,CHN,"Jiangxi, Hebei, Shanxi, Jiangsu, Shandong, Henan, Hubei, Shaanxi, Sichuan, Guizhou, Gansu, Chongqing",,,,Km2,Flood,--,--,--,77,225000,373000,0,"",2018-0210,,,,,,,,,,,,,,,,,,
07,07,2018,07,07,2018,China,CHN,"Deyang, Mianyang, Guangyuan prefectures (Sichuan province)",,,,Km2,Flood,--,--,--,3,1381000,781283,0,"",2018-0250,,,,,,,,,,,,,,,,,,
10,07,2018,11,07,2018,China,CHN,"Tianshui, Zhangye, Pingliang, Gansu provinces",,,,Km2,Flood,--,--,--,16,1519000,530689,0,"",2018-0252,,,,,,,,,,,,,,,,,,
28,06,2018,05,07,2018,China,CHN,"",,,,Km2,Flood,Riverine flood,Storm,--,11,36000,278000,0,"",2018-0282,,,,,,,,,,,,,,,,,,
29,08,2018,05,09,2018,China,CHN,"",,,,Km2,Flood,--,--,--,18,11400,790000,0,"",2018-0369,,,,,,,,,,,,,,,,,,
"",01,1999,"",01,1999,Colombia,COL,North-West,,,,Km2,Flood,--,--,--,9,250,0,0,"",1999-0087,CO,Colombia,,,,,,,1795.39924429621,86186158684.7685,58.7,,,4413,39819279,,1374,
04,10,1999,15,10,1999,Colombia,COL," Florencia, Puerto Lopez, Cauca, Narino, Huila, Putumayo, Valle",,,,Km2,Flood,--,"Slide (land, mud, snow, rock)",--,29,150040,3,0,"",1999-0372,CO,Colombia,,,,,,,1795.39924429621,86186158684.7685,58.7,,,4413,39819279,,1374,
"",11,1999,"",11,1999,Colombia,COL,"South Colombia, Pacific Coast",,,,Km2,Flood,Coastal flood,--,--,3,1100,0,0,"",1999-0448,CO,Colombia,,,,,,,1795.39924429621,86186158684.7685,58.7,,,4413,39819279,,1374,
"",02,2000,"",02,2000,Colombia,COL,"Tolima, Santander, Valle provinces",,,,Km2,Flood,--,--,--,8,39000,0,0,"",2000-0098,CO,Colombia,,,,,,,2007.34188473996,99886577330.7271,58.7,,,9279,40403958,,1023,
18,05,2000,24,05,2000,Colombia,COL,"Narino, Putumayo, Santander, Antioquia, Choco, Cundinamarca, Tolima, Valle del Cauca, Amazonas provinces",,,2e+05,Km2,Flood,Riverine flood,"Slide (land, mud, snow, rock)",Transport accident,96,12000,0,0,"",2000-0265,CO,Colombia,,,,,,,2007.34188473996,99886577330.7271,58.7,,,9279,40403958,,1023,
20,09,2000,20,09,2000,Colombia,COL,"Ayapel district (Cordoba province), San Benito Abad district (Sucre province)",,,,Km2,Flood,Riverine flood,--,--,9,28000,0,0,"",2000-0648,CO,Colombia,,,,,,,2007.34188473996,99886577330.7271,58.7,,,9279,40403958,,1023,
09,04,2001,09,04,2001,Colombia,COL,"Colon, Santiago, Sibundoy, San Francisco districts (Putumayo province)",,,,Km2,Flood,Riverine flood,--,--,0,1500,0,0,"",2001-0156,CO,Colombia,,,,,,,1974.36007676354,98203546156.3102,57.2,,,17938,40988909,,1072,
"",12,2001,"",12,2001,Colombia,COL,"Tolima, Cundinamarca, Antioquia provinces",,,,Km2,Flood,Riverine flood,--,--,0,4500,0,0,"",2001-0712,CO,Colombia,,,,,,,1974.36007676354,98203546156.3102,57.2,,,17938,40988909,,1072,
24,04,2002,29,04,2002,Colombia,COL,"Antioquia, Bolivar, Boyaca, Caldas, Caqueta, Casanare, Cauca, Cesar, Choco, Cordoba, Cundinamarca, Huila, Meta, Nariño, Norte De Santander, Putumayo, Quindío, Risaralda, Santander, Sucre, Tolima, Valle Del Cauca provinces",,,483000,Km2,Flood,Riverine flood,--,--,37,38000,0,0,"",2002-0307,CO,Colombia,,,,,,,1931.60970997076,97933391976.083,55.8,,,30625,41572491,,2263,
04,06,2002,13,06,2002,Colombia,COL,"Antioquia, Bolivar, Cesar, Cundinamarca, Choco, Santander, Casanare, Tolima provinces",,,369950,Km2,Flood,Riverine flood,"Slide (land, mud, snow, rock)",--,28,73013,0,0,"",2002-0339,CO,Colombia,,,,,,,1931.60970997076,97933391976.083,55.8,,,30625,41572491,,2263,
05,07,2002,08,08,2002,Colombia,COL,Arauca province,,,,Km2,Flood,Riverine flood,Broken Dam/Burst bank,--,0,12500,0,0,"",2002-0839,CO,Colombia,,,,,,,1931.60970997076,97933391976.083,55.8,,,30625,41572491,,2263,
"",11,2002,"",11,2002,Colombia,COL,Tierralta district (Cordoba province),,,0,Km2,Flood,--,--,--,0,1025,0,0,"",2002-0845,CO,Colombia,,,,,,,1931.60970997076,97933391976.083,55.8,,,30625,41572491,,2263,
14,06,2003,16,06,2003,Colombia,COL,Florencia district (Caqueta province),,,3350,Km2,Flood,Riverine flood,"Slide (land, mud, snow, rock)",--,3,4000,0,0,"",2003-0284,CO,Colombia,,,,,,,1812.68647824744,94684584162.773,53.4,,,37995,42152151,,737,
"",08,2003,"",12,2003,Colombia,COL,"Antioquia, Atlantico, Bolivar, Boyaca, Caldas, Cesar, Cordoba, Cundinamarca, Choco, Guajira, Huila, Magdalena, Norte de Santander, Quindio, Risaralda, Santander, Sucre, Tolima, Valle del Cauca provinces",,,,Km2,Flood,Riverine flood,"Slide (land, mud, snow, rock)",Rain,42,35752,0,0,"",2003-0578,CO,Colombia,,,,,,,1812.68647824744,94684584162.773,53.4,,,37995,42152151,,737,
14,05,2003,28,05,2003,Colombia,COL,"Choco, Antioquia, Cordoba provinces",,,,Km2,Flood,Riverine flood,"Slide (land, mud, snow, rock)",--,35,0,0,0,"",2003-0788,CO,Colombia,,,,,,,1812.68647824744,94684584162.773,53.4,,,37995,42152151,,737,
"",01,2004,28,06,2004,Colombia,COL,"Antioquia, Boyaca, Bolivar, Cauca, Cordoba, Choco, Cundimarca, Guajira, Meta, Norte de Santander, Tolima, Valle del Cauca, Arauca, Casanare, Atlantico, Caldas, Caqueta, Guaviare, Madgalena, Narino, Putumayo, Quindio, Risaralda, Vichada provinces",,,108,Km2,Flood,Riverine flood,"Slide (land, mud, snow, rock)",--,79,186096,0,0,"",2004-0202,CO,Colombia,,,,,,,2201.28147789305,117074863821.85,54.8,,,47381,42724163,,1234,
11,10,2004,26,10,2004,Colombia,COL,"Envigado, Copacabana, Bello, Medellin, Caldas, La Estrella districts (Antioquia province), Sabanagrande, Barranquilla districts (Atlantico province), Monteria, Ayapel (La Apartada), Cienaga de Oro, Cerete, San Pelayo, Momil, Planeta Rica, Purisima, Monitos (isl.), Lorica, San Andres de Sotavento, Tierralta, Los Cordobas, San Carlos, Montelibano, Puerto Libertador, San Bernado districts (Cordoba province), Cartagena, Santa Catalina (Clemencia), San Fernando, Simitri districts (Bolivar province), Cienaga (Zona Bananera) district(Magdalena province), Villa Caro, Machique, Ocana, Teorama districts (Norte of Santander province), Purificacion, Carmen de Apicala, Armero Guayabal, Icononzo districts (Tolima province), Riosuco districts (Caldas province), Popayan, Lopez de Micay, Timbiqui districts (Cauca province), Valledupar district (Cesar province), Capital City Bogota, Yacopi districts (Cundimarca province), Riohacha district (Guajira province), Garzon district (Huila province), Villavicencio, El Calvario district (Meta province), Samaniego, Pasto, Barbacoas districts (Nariño province), Sibundoy district (Putumayo province), Circasia district (Quindío province), Punto Caldas, Pereira districts (Risaralda province), San Pedro district (Sucre province), Bugalagrande district (Valle province)",,,,Km2,Flood,Riverine flood,"Slide (land, mud, snow, rock)",--,36,345386,0,0,"",2004-0520,CO,Colombia,,,,,,,2201.28147789305,117074863821.85,54.8,,,47381,42724163,,1234,
11,02,2005,26,02,2005,Colombia,COL,"Santander, Tolima, Huila, Norte de Santander, Quindio, Choco, Caldas, Boyaca, Meta, Cundinamarca, Antioquia, Cordoba provinces",,,,Km2,Flood,Riverine flood,"Slide (land, mud, snow, rock)",Collapse,56,85729,10000,0,"",2005-0083,CO,Colombia,,,,,,,2699.82177648376,146566264837.014,53.7,,,60450,43285634,,1389,
12,04,2005,07,05,2005,Colombia,COL,"Boyaca, Antioquia, Santander, Huila, Risaralda, Tolima provinces",,,,Km2,Flood,Riverine flood,"Slide (land, mud, snow, rock)",--,23,41530,0,0,"",2005-0196,CO,Colombia,,,,,,,2699.82177648376,146566264837.014,53.7,,,60450,43285634,,1389,
15,09,2005,17,11,2005,Colombia,COL,"Antioquia, Atlantico, Bolivar, Boyaca, Caldas, Caqueta, Casanare, Cauca, Cundinamarca, Guajira, Huila, Meta, Narino, Norte de Santander, Putumayo, Quindio, Risaralda, Santander, Sans Andres y Providencia, Sucre, Tolima, Valle, Cordoba, Choco, Cesar, Magdalena provinces",,,115200,Km2,Flood,Riverine flood,--,--,101,474607,0,0,"",2005-0572,CO,Colombia,,,,,,,2699.82177648376,146566264837.014,53.7,,,60450,43285634,,1389,
01,01,2006,27,04,2006,Colombia,COL,"Choco, Valle del Cauca, Cauca, Narino, Antioquia, Caldas, Risaralda, Quindio, Tolima, Arauca, Santander, Norte de Santander, Cundinamarca, Boyaca, Casanare, Meta, Bolivar, Cesar, Cundinamarca, Huila, Narino, Sucre, Caqueta provinces",5.43,-75.6,,Km2,Flood,Riverine flood,"Slide (land, mud, snow, rock)",Rain,150,221465,0,0,"",2006-0140,CO,Colombia,,,,,,,2936.43159289282,162590146096.414,,,,72796,43835722,,502,
06,03,2007,30,09,2007,Colombia,COL,"Cordoba, Bolivar, Sucre, Choco, Guajira, Atlantico, Antioquia, Magdalena provinces",8.38,-75.59,69990,Km2,Flood,Riverine flood,"Slide (land, mud, snow, rock)",--,146,1504317,0,0,"",2007-0162,CO,Colombia,,,,,,,3732.66189453176,207416494642.379,,,,551744,44374572,,314,
19,05,2007,12,06,2007,Colombia,COL,"Taraza, Valdivia, Nechi, Zaragoza districts (Antioquia province), Guaranda district (Sucre province), Inza, Popayan districts (Cauca province)",7.38,-75.43,29770,Km2,Flood,Riverine flood,"Slide (land, mud, snow, rock)",--,13,3000,0,0,"",2007-0176,CO,Colombia,,,,,,,3732.66189453176,207416494642.379,,,,551744,44374572,,314,
26,04,2007,01,05,2007,Colombia,COL,Ibague district (Tolima province),4.5,-75.21,1940,Km2,Flood,Riverine flood,"Slide (land, mud, snow, rock)",--,24,2035,0,0,"",2007-0191,CO,Colombia,,,,,,,3732.66189453176,207416494642.379,,,,551744,44374572,,314,
20,10,2007,26,10,2007,Colombia,COL,"Antioquia, Risaralda, Cundinamarca, Guaviare, Sucre, Bolivar, Cordoba, Valle del Cauca, Choco, Magdalena , Guajira,  Caldas, Atlantico, Cesar, Norte de Santander, Santander, Boyaca, Arauca, Casanare, Quindio, Tolima, Huila, Cauca, Narino, Caqueta, Meta, Amazonas, Putumayo provinces",7.89,-74.91,189700,Km2,Flood,Riverine flood,--,--,35,1162135,0,0,"",2007-0529,CO,Colombia,,,,,,,3732.66189453176,207416494642.379,,,,551744,44374572,,314,
11,03,2008,14,03,2008,Colombia,COL,"Campo Alegre, Santa Maria districts (Huila province)",2.68,-75.42,,Km2,Flood,Riverine flood,"Slide (land, mud, snow, rock)",--,11,0,0,0,"",2008-0121,CO,Colombia,,,,,,,4269.02453276618,243982437870.84,55.4,,,373532,44901544,,219,
15,09,2008,12,01,2009,Colombia,COL,"Magdalena, Antioquia, Bolivar, Choco, Sucre, Cordoba, Huila, Tolima, Valle del Cauca, Caqueta, Putumayo, San Andres and Providencia, Atlantico, Santander, Cauca, Cundinamarca, Boyaca, Arauca, Norte de Santander, Cesar, La Guajira, Caldas, Risaralda, Narino, Meta, Casanare provinces",9,-74.23,195400,Km2,Flood,Riverine flood,--,--,76,1200091,0,0,"",2008-0559,CO,Colombia,,,,,,,4269.02453276618,243982437870.84,55.4,,,373532,44901544,,219,
15,02,2009,17,02,2009,Colombia,COL,"Tumaco isl., Tumaco, Linares, Barbacoas, Mallama, Ipiales, Ricaurte, Roberto Payan , El Rosario, Magui, Los Andes districts (Narino province) , Antioquia, Santander, Cauca, Tolima provinces",4.36,-76.51,72650,Km2,Flood,Riverine flood,"Slide (land, mud, snow, rock)",--,23,31250,0,0,"",2009-0035,CO,Colombia,,,,,0.657133753962299,,4158.91294811611,233821670544.258,54.5,,,389753,45416181,,377,4916000
06,04,2010,07,03,2011,Colombia,COL,"Sucre, Bolivar, Cordoba, Antioquia, Atlantico, Narino, Valle del Cauca, Magdalena, Caqueta, Cesar, Cauca, Boyaca, Cundinamarca, Santander, Choco, Caldas, Guajira, Tolima, Huila, Risaralda, Meta, Putumayo, Quindio, Arauca, Casanare, Amazonas, Guaviare provinces",4.113,-72.96,1140146,Km2,Flood,Riverine flood,--,--,418,2791999,1000000,14000,"",2010-0168,CO,Colombia,,,,,,,4986.44973714449,287018184637.529,54.8,,,395577,45918097,,419,5196000
09,08,2010,13,08,2010,Colombia,COL,"Paraguachon, La Majayura, Carraipia cities (Maicao district, Guajira province)",,,,Km2,Flood,Riverine flood,--,--,0,800,0,0,"",2010-0401,CO,Colombia,,,,,,,4986.44973714449,287018184637.529,54.8,,,395577,45918097,,419,5196000
01,07,2010,12,07,2010,Colombia,COL,"Magui Payan municipality (Magui district, Nariño province)",,,,Km2,Flood,Riverine flood,--,--,0,3761,0,0,"",2010-0430,CO,Colombia,,,,,,,4986.44973714449,287018184637.529,54.8,,,395577,45918097,,419,5196000
"",04,2011,"",07,2011,Colombia,COL,"Antioquia, Santander, Bolivar, Magdalena, Sucre, Atlantico, La Guajira, Cesar, Cordoba, Choco, Risaralda, Caldas, Norte de Santander, Arauca, Boyaca, Casanare, Cundinamarca, Quindio, Valle Del Cauca, Tolima, Huila, Cauca, Narino, Putumayo, Caqueta, Meta, Guainia, Guaviare, Amazonas",5.69,-74.15,236086,Km2,Flood,Riverine flood,"Slide (land, mud, snow, rock)",--,138,988599,1030000,41000,"",2011-0132,CO,Colombia,,,,3.75,,,5574.16291416363,335415156702.186,53.6,,,395949,46406646,,202,5281000
01,09,2011,29,12,2011,Colombia,COL,"Valle del Cauca, Norte de Santander, Santander, Antioquia, Boyaca, Caldas, Casanare, Choco, Tolima, Quindio, Huila, Cauca, Meta, Magdalena, Sucre, Cesar, Cordoba, Risaralda, Atlantico, Guajira, Bolivar, Cundinamarca, Narino, Caqueta, San Andres y Providencia, Putumayo, Guaviare provinces",4.64,-73.94,57194,Km2,Flood,Riverine flood,"Slide (land, mud, snow, rock)",--,135,498924,1290000,0,"",2011-0386,CO,Colombia,,,,3.75,,,5574.16291416363,335415156702.186,53.6,,,395949,46406646,,202,5281000
20,04,2012,26,04,2012,Colombia,COL,Soacha district (Cundinamarca province),3.606,-73.07,74036,Km2,Flood,Riverine flood,--,--,17,56000,40000,0,"",2012-0187,CO,Colombia,,,,,,,6163.53645452742,369659700375.52,52.9,,,394117,46881475,,211,5455000
15,03,2012,14,05,2012,Colombia,COL,"Casanare, Amazonas, Valle del Cauca, Narino, Bocaya, Putumayo, Huila, Sucre, Cordoba, Santander, Cundimarca, Cauca, Choco provinces",,,,Km2,Flood,Riverine flood,--,--,48,8000,62000,0,"",2012-0238,CO,Colombia,,,,,,,6163.53645452742,369659700375.52,52.9,,,394117,46881475,,211,5455000
05,10,2012,19,10,2012,Colombia,COL,"Villa del Prado town (Isnos district, Huila province)",,,,Km2,Flood,Riverine flood,--,--,12,17518,0,0,"",2012-0457,CO,Colombia,,,,,,,6163.53645452742,369659700375.52,52.9,,,394117,46881475,,211,5455000
15,09,2013,01,12,2013,Colombia,COL,"Boyaca, Caldas, Cundinamarca, Huila, Quindio, Risaralda, Choco, Valle del Cauca, Magdalena, Bolivar, Antioquia, Atlantico, Cauca provinces",,,,Km2,Flood,Riverine flood,"Slide (land, mud, snow, rock)",Storm,7,51781,2000,0,"",2013-0513,CO,Colombia,,,,,,,6341.80086226419,380191881860.372,52.9,,,396717,47342981,,140,5700000
06,01,2014,06,01,2014,Colombia,COL,"Tandandao, Santa Rosa, Sanandocito, Marqueza, Teatino, Canaveral, Chambacu, San Augustin, Brisas, Charco Hondo, Barranconcito, Loma de CHupey, Barrancon, Charco Largo cities (Sipi district, Choco province)",,,,Km2,Flood,Riverine flood,Broken Dam/Burst bank,--,0,8978,0,0,"",2014-0019,CO,Colombia,,,,,,,6297.21808423733,378195716714.266,52.8,,,360298,47791911,,114,6044000
15,03,2014,15,05,2014,Colombia,COL,"Cauca, Caqueta, Choco, Magdalena, Caldas provinces",,,,Km2,Flood,Riverine flood,--,--,33,41151,0,0,"",2014-0430,CO,Colombia,,,,,,,6297.21808423733,378195716714.266,52.8,,,360298,47791911,,114,6044000
14,06,2014,14,06,2014,Colombia,COL,"Sibundoy, Colon, Santiago, San Francisco districts (Putumayo province)",,,,Km2,Flood,Riverine flood,--,--,0,4085,0,0,"",2014-0431,CO,Colombia,,,,,,,6297.21808423733,378195716714.266,52.8,,,360298,47791911,,114,6044000
01,11,2014,20,12,2014,Colombia,COL,Choco province,,,406009,Km2,Flood,Riverine flood,--,--,44,18000,8000,0,"",2014-0505,CO,Colombia,,,,,,,6297.21808423733,378195716714.266,52.8,,,360298,47791911,,114,6044000
22,07,2015,06,08,2015,Colombia,COL,"San Miguel, Puerto Asis, V/Guamuez",,,,Km2,Flood,Riverine flood,--,--,0,8105,0,0,"",2015-0325,CO,Colombia,,,,,,,5033.5000390578,291519591532.951,51.1,,,340127,48228697,,134,6270000
26,11,2016,05,12,2016,Colombia,COL,Cali city (Siloé district),,,,Km2,Flood,--,"Slide (land, mud, snow, rock)",--,6,72,0,0,"",2016-0522,CO,Colombia,,,,,,,4820.32852747321,280090999648.115,50.8,,,311062,48653419,,30,7246000
18,10,2016,22,10,2016,Colombia,COL,Choco department,,,,Km2,Flood,Riverine flood,--,--,4,2200,0,0,"",2016-0533,CO,Colombia,,,,,,,4820.32852747321,280090999648.115,50.8,,,311062,48653419,,30,7246000
17,03,2017,27,03,2017,Colombia,COL,"Antioquia, Cundinamarca, Cauca, Valle del Cauca, Nariño, Santander, Chocó, Caldas, Putumayo, César, Risaralda",,,,Km2,Flood,Riverine flood,"Slide (land, mud, snow, rock)",Storm,12,3000,2000,0,"",2017-0215,CO,Colombia,,,,,,,,309191382833.365,,,,191607,49065615,,,6509000
23,02,2017,03,03,2017,Colombia,COL,"Cundinamarca (Guacheta), Huila (Rivera), Antioquia (Medellin, Itagui, Aburra Valley) departments",3.723,-72.674,128596.78,Km2,Flood,--,--,--,1,2000,0,0,"",2017-0223,CO,Colombia,,,,,,,,309191382833.365,,,,191607,49065615,,,6509000
05,01,2017,07,02,2017,Colombia,COL,"Nariño Department (Olaya Herrera, Arboleda, Barbacoas, Roberto Payán, Magui Payán, Policarpa, Santa Bárbara de Iscuandé, Tumaco)",1.691,-76.286,117321.46,Km2,Flood,--,--,--,0,25661,0,0,"",2017-0225,CO,Colombia,,,,,,,,309191382833.365,,,,191607,49065615,,,6509000
09,11,2017,09,11,2017,Colombia,COL,Corinto (Cauca),,,,Km2,Flood,--,"Slide (land, mud, snow, rock)",--,22,192,0,0,"",2017-0478,CO,Colombia,,,,,,,,309191382833.365,,,,191607,49065615,,,6509000
"",03,2018,"",04,2018,Colombia,COL,"Norte de Santander, Cundinamarca, Choco, Narino, Tolima, Santander, Antioquia, Boyaca, Valle del Cauca",,,,Km2,Flood,--,Storm,--,14,0,0,0,"",2018-0131,,,,,,,,,,,,,,,,,,
20,04,2009,24,04,2009,Comoros (the),COM,"Ngazidja, Anjouan, Moheli provinces",,,,Km2,Flood,Riverine flood,--,--,2,2500,0,0,"",2009-0092,KM,Comoros,561304,,,,0.0221911585453536,59.4520883602229,679.359543652124,524157261.014644,,,,268,673252,0.425,,
20,04,2012,28,04,2012,Comoros (the),COM,"Bambao, Hambou, Mbadjini East areas (Ngazidja province), Domoni, Sima areas (Anjouan province), Nioumachioi, Hoani areas (Moheli province)",,,,Km2,Flood,Riverine flood,"Slide (land, mud, snow, rock)",--,4,65137,5000,0,"",2012-0113,KM,Comoros,,,,,,,707.728029004072,570865941.229395,,,,454,723868,,,
29,11,1999,29,11,1999,Congo (the Democratic Republic of the),COD,Kinshasa,,,,Km2,Flood,Flash flood,--,--,2,78000,0,0,"",1999-0531,CD,"Congo, Dem. Rep.",,,,,,,78.9272941838694,4711259427.27273,,,,255950,45898667,,3282,
18,05,2001,18,05,2001,Congo (the Democratic Republic of the),COD,Kinshasa district (Kinshasa province),,,,Km2,Flood,Riverine flood,--,--,50,26,0,0,"",2001-0209,CD,"Congo, Dem. Rep.",,,,,,33.6900788613423,122.597479948661,7438189100.33333,,,,392146,48394338,,486,
14,12,2001,14,12,2001,Congo (the Democratic Republic of the),COD,Mbandaka district (Equateur province),,,3270,Km2,Flood,Riverine flood,--,--,0,13000,0,0,"",2001-0683,CD,"Congo, Dem. Rep.",,,,,,33.6900788613423,122.597479948661,7438189100.33333,,,,392146,48394338,,486,
06,02,2002,08,02,2002,Congo (the Democratic Republic of the),COD,"Uvira area (Sud-Kivu district, Sud-Kivu province)",,,1980,Km2,Flood,Riverine flood,"Slide (land, mud, snow, rock)",--,40,2540,0,0,"",2002-0080,CD,"Congo, Dem. Rep.",96824578,,3889050,,,34.4591588058256,142.367806680283,8728038525.14034,,,,421362,49835756,,76,
"",10,2003,"",10,2003,Congo (the Democratic Republic of the),COD,Kisangani district (Orientale province),,,,Km2,Flood,Riverine flood,--,--,0,600,0,0,"",2003-0566,CD,"Congo, Dem. Rep.",138547061,,3768605,,,32.2128098639855,139.429317765967,8937567059.87754,,,,453465,51390033,,,
14,12,2003,15,12,2003,Congo (the Democratic Republic of the),COD,"Lufutoto town (Mbanza-Ngungu area, Cataractes district, Bas-Congo province)",,,,Km2,Flood,Riverine flood,--,--,1,881,0,0,"",2003-0641,CD,"Congo, Dem. Rep.",138547061,,3768605,,,32.2128098639855,139.429317765967,8937567059.87754,,,,453465,51390033,,,
18,02,2006,20,02,2006,Congo (the Democratic Republic of the),COD,Lukaya district (Bas-Congo province),,,,Km2,Flood,Riverine flood,--,--,0,3870,0,0,"",2006-0145,CD,"Congo, Dem. Rep.",356892355,753107,3303915,,,35.1355782032296,182.529921547565,14451902467.9315,,,,401914,56543011,0.262,177,
08,04,2006,27,04,2006,Congo (the Democratic Republic of the),COD,"Kisenso, Limete, Matete, Masina, Kimbanseke areas (Kinshasa district, Kinshasa province)",-4.36,16.17,45540,Km2,Flood,Riverine flood,"Slide (land, mud, snow, rock)",--,1,5500,0,0,"",2006-0172,CD,"Congo, Dem. Rep.",356892355,753107,3303915,,,35.1355782032296,182.529921547565,14451902467.9315,,,,401914,56543011,0.262,177,
"",12,2006,"",12,2006,Congo (the Democratic Republic of the),COD,"Bumba area (Mongala district, Equateur province)",,,,Km2,Flood,Riverine flood,--,--,0,3600,0,0,"",2006-0673,CD,"Congo, Dem. Rep.",356892355,753107,3303915,,,35.1355782032296,182.529921547565,14451902467.9315,,,,401914,56543011,0.262,177,
25,10,2007,31,10,2007,Congo (the Democratic Republic of the),COD,Kinshasa district (Kinshasa province),-4.37,15.38,1950,Km2,Flood,Riverine flood,"Slide (land, mud, snow, rock)",--,32,1600,0,0,"",2007-0527,CD,"Congo, Dem. Rep.",364469745,1037408,1170438,,,38.0279742147556,194.596058753859,16737071816.4195,,,,370374,58417562,0.28,632,
02,04,2008,02,04,2008,Congo (the Democratic Republic of the),COD,"Kasai Occidental, Bandundu provinces",,,,Km2,Flood,Riverine flood,Rain,--,15,502,0,0,"",2008-0139,CD,"Congo, Dem. Rep.",521688615,7351740,2254980,,,36.5013608745207,210.920154693814,19788515873.9704,,,,367995,60373608,0.282,767,
16,11,2009,16,11,2009,Congo (the Democratic Republic of the),COD,"Mbuji-Mayi, Mwene-Ditu districts (Kasai Oriental province)",,,,Km2,Flood,Riverine flood,--,--,0,5000,0,0,"",2009-0544,CD,"Congo, Dem. Rep.",534468822,2338537,5410,,0.0178909622770062,37.9998946340283,197.660934373839,18648373312.3884,,,,455852,62409435,0.289,1978,1900000
17,03,2010,17,03,2010,Congo (the Democratic Republic of the),COD,"Bukama area (Haut-Lomami district, Katanga province)",,,,Km2,Flood,Riverine flood,--,--,0,67500,0,0,"",2010-0133,CD,"Congo, Dem. Rep.",444040473,1903767,3833,,,38.0335083064663,227.653677647135,21565722425.0028,,,,476693,64523263,0.295,300,1700000
26,07,2010,26,07,2010,Congo (the Democratic Republic of the),COD,"Basankusu area (Equateur district, Equateur province)",,,,Km2,Flood,Riverine flood,--,--,0,3000,0,0,"",2010-0357,CD,"Congo, Dem. Rep.",444040473,1903767,3833,,,38.0335083064663,227.653677647135,21565722425.0028,,,,476693,64523263,0.295,300,1700000
"",12,2011,"",12,2011,Congo (the Democratic Republic of the),COD,Sud-Kivu province,,,,Km2,Flood,Riverine flood,--,--,0,2000,0,0,"",2011-0516,CD,"Congo, Dem. Rep.",445155534,1893794,117877,,,38.0335083064663,239.504831472256,25839749198.7761,,,,491481,66713597,0.299,283,1710000
"",12,2011,"",12,2011,Congo (the Democratic Republic of the),COD,Bas-Congo province,,,,Km2,Flood,Riverine flood,--,--,0,6000,0,0,"",2011-0517,CD,"Congo, Dem. Rep.",445155534,1893794,117877,,,38.0335083064663,239.504831472256,25839749198.7761,,,,491481,66713597,0.299,283,1710000
15,01,2012,22,01,2012,Congo (the Democratic Republic of the),COD,"Kabalo area (Tanganyka district, Katanga province)",,,,Km2,Flood,Riverine flood,--,--,1,4535,0,0,"",2012-0046,CD,"Congo, Dem. Rep.",,,,,,,265.726730759228,29306223081.1458,42.1,,,509290,68978682,,773,2700000
25,10,2014,28,10,2014,Congo (the Democratic Republic of the),COD,"Bushushu, Kalehe towns (Kalehe area, Sud-Kivu district, Sud-Kivu province)",,,,Km2,Flood,Flash flood,"Slide (land, mud, snow, rock)",Lightening,154,4750,15000,0,"",2014-0432,CD,"Congo, Dem. Rep.",,,,,,,317.448160904279,35917650629.612,,,,516771,73722860,,985,2757000
11,12,2015,12,12,2015,Congo (the Democratic Republic of the),COD,Bukavu district (Sud-Kivu province),,,,Km2,Flood,--,"Slide (land, mud, snow, rock)",--,18,0,0,0,"",2015-0535,CD,"Congo, Dem. Rep.",,,,,,,345.712966460038,37917704900.1192,,,,541496,76196619,,197,1500000
19,11,2015,17,12,2015,Congo (the Democratic Republic of the),COD,"Debonhome, Ndanu, Kingabua, Pécheur, Salongo boroughs (Kinshasa district, Kinshasa province)",,,,Km2,Flood,--,--,--,31,10560,0,0,"",2015-0536,CD,"Congo, Dem. Rep.",,,,,,,345.712966460038,37917704900.1192,,,,541496,76196619,,197,1500000
07,11,2015,23,11,2015,Congo (the Democratic Republic of the),COD,"Tshopo, Haut-Uele districts (Orientale province)
",,,,Km2,Flood,--,--,--,0,180000,0,0,"",2015-0549,CD,"Congo, Dem. Rep.",,,,,,,345.712966460038,37917704900.1192,,,,541496,76196619,,197,1500000
09,11,2016,09,11,2016,Congo (the Democratic Republic of the),COD,"Gemena city (Sud-Ubangi district, Equateur province)",,,,Km2,Flood,Flash flood,Storm,--,0,2635,0,0,"",2016-0451,CD,"Congo, Dem. Rep.",,,,,,,331.976940475941,34991160099.7415,,,,537473,78736153,,425,2230000
27,12,2016,28,12,2016,Congo (the Democratic Republic of the),COD,Boma district (Bas-Congo province),,,,Km2,Flood,Flash flood,--,--,50,10000,0,0,"",2016-0507,CD,"Congo, Dem. Rep.",,,,,,,331.976940475941,34991160099.7415,,,,537473,78736153,,425,2230000
19,09,2017,20,09,2017,Congo (the Democratic Republic of the),COD,"Bihambwe, Matanda",,,,Km2,Flood,--,--,--,105,500,0,0,"",2017-0391,CD,"Congo, Dem. Rep.",,,,,,,,37241300948.659,,,,620775,81339988,,1933,4480000
