15,08,2010,15,08,2010,Philippines (the),PHL,"Brgys Putik, Tugbungan, Boalan barangays villages (Zamboanga City area, Zamboanga Del Sur district, Region IX province)",,,,Km2,Flood,Flash flood,--,--,0,505,0,0,"",2010-0398,PH,Philippines,,,,,,,2282.69645226778,199590775189.305,,,,970,93726624,,332,15000
10,09,2010,17,09,2010,Philippines (the),PHL,"Polomok, Koronadal City, Banga, Tupi areas (South Cotabato district, Region XII province), Lambayong, Tacurong City areas (Sultan Kudarat district, Region XII province), Marilog, Davao City areas (Davao Del Sur district, Region XI province), Kalilangan areas (Bukidnon Region X province), Cagayan de Oro City area (Misamis Oriental district, Region X province)",,,,Km2,Flood,Flash flood,"Slide (land, mud, snow, rock)",--,6,46713,3156,0,"",2010-0488,PH,Philippines,,,,,,,2282.69645226778,199590775189.305,,,,970,93726624,,332,15000
01,11,2010,10,11,2010,Philippines (the),PHL,"Isabela, Cagayan, Quirino districts (Region II province), Kalinga district (CAR province), Aurora district (Region III province)",17.71,121.8,15301,Km2,Flood,Riverine flood,"Slide (land, mud, snow, rock)",--,16,450673,0,0,"",2010-0585,PH,Philippines,,,,,,,2282.69645226778,199590775189.305,,,,970,93726624,,332,15000
24,12,2010,25,01,2011,Philippines (the),PHL,"Palawan district (Region IV province), Albay, Sorsogon, Catanduanes districts (Region V province), Bohol, Cebu districts (Region VII (Central Visayas) province), Eastern Samar, Leyte, Samar, Northern Samar, Southern Leyte districts (Region VIII province), Camiguin, Lanao del Norte districts (Region X (Northern Mindanao) province), Compostela, Davao Oriental, Davao del Norte, Davao del Sur districts (Region XI (Davao region) province), South Cobato district (Region XII province), Agusan del Norte, Agusan del Sur, Surigao del Norte, Surigao del Sur districts (Region XIII (Caraga) province), Maguindanao  district (ARMM province)",8.132,125.57,10773,Km2,Flood,Flash flood,"Slide (land, mud, snow, rock)",--,110,1972446,47411,0,"",2010-0659,PH,Philippines,,,,,,,2282.69645226778,199590775189.305,,,,970,93726624,,332,15000
25,01,2011,07,02,2011,Philippines (the),PHL,"Southern Leyte district (Region VIII (Eastern Visayas) province), Camiguin, Misamis Occidental, Misamis Oriental districts (Region X (Northern Mindanao) province), Compostela, Davao Oriental districts (Region XI (Davao region) province), Agusan del Norte, Agusan del Sur, Dinagat, Surigao del Norte, Surigao del Sur districts (Region XIII (Caraga) province), Masbate district (Region V (Bicol region) province), Sulu district (ARMM province) ",9.40044,125.78,3623,Km2,Flood,Riverine flood,"Slide (land, mud, snow, rock)",--,23,638418,12411,0,"",2011-0021,PH,Philippines,,,,,,,2493.56674985824,224143083707.403,,,,952,95277940,,350,46000
01,02,2011,04,02,2011,Philippines (the),PHL,"Sulu district (ARMM province), Surigao del Norte, Agusan del Norte, Surigao del Sur, Agusan del Sur districts (Region XIII province)",124.865,7.1,44521,Km2,Flood,Riverine flood,--,--,11,2000,0,0,"",2011-0044,PH,Philippines,,,,,,,2493.56674985824,224143083707.403,,,,952,95277940,,350,46000
14,03,2011,18,03,2011,Philippines (the),PHL,"Bohol district (Central Visayas province), Biliran, Eastern Samar, Leyte, Northern Samar, Samar, Southern Leyte districts (Eastern Visayas province), Lanao del Norte, Misamis Oriental districts (Northern Mindanao province), South Cotabato district (Soccsksargen province), Surigao Del Sur district (Caraga province)",125.091,259.63,25963,Km2,Flood,Riverine flood,"Slide (land, mud, snow, rock)",Rain,16,241777,280,0,"",2011-0087,PH,Philippines,,,,,,,2493.56674985824,224143083707.403,,,,952,95277940,,350,46000
31,05,2011,19,06,2011,Philippines (the),PHL,"Bukidnon district (Region X province), Compostela, Davao Del Sur districts (Region XI province), North Cotabato, Sultan Kudarat districts (Region XII province), Maguindanao district (ARMM province)",8.306,125.21,71700,Km2,Flood,Riverine flood,"Slide (land, mud, snow, rock)",--,12,944781,10666,0,"",2011-0204,PH,Philippines,,,,,,,2493.56674985824,224143083707.403,,,,952,95277940,,350,46000
28,06,2011,29,06,2011,Philippines (the),PHL,"Davao City area (Davao Del Sur district, Region XI (Davao Region) province), Cotabato City area (Shariff Kabunsuan district, Autonomous region in Muslim Mindanao (ARMM) province), Metropolitan Manila district (National Capital region (NCR) province), Bulacan, Pampanga, Bataan, Tarlac, Zambales districts (Region III (Central Luzon) province), Batangas district (Region IV-A (Calabarzon) province), Albay district (Region V (Bicol) province), La Union, Pangasinan districts (Region I (Ilocos Region) province), Region X (Northern Mindanao), Region XII (Soccsksargen) provinces",7.39811,126.05,6361,Km2,Flood,Flash flood,--,--,31,121005,251,0,"",2011-0221,PH,Philippines,,,,,,,2493.56674985824,224143083707.403,,,,952,95277940,,350,46000
05,08,2011,05,08,2011,Philippines (the),PHL,"Buntalala, Calubihan, Desamparados, Lanit boroughs (Jaro area, Iloilo City area, Iloilo district, Region VI province), Calajunan borough (Manduriao area, Iloilo City area, Iloilo district, Region VI province), Sooc borough (Arevalo area, Iloilo City area, Iloilo district, Region VI province)",,,,Km2,Flood,Riverine flood,--,--,0,2060,0,0,"",2011-0301,PH,Philippines,,,,,,,2493.56674985824,224143083707.403,,,,952,95277940,,350,46000
19,09,2011,19,09,2011,Philippines (the),PHL,"Landan, Upper Klinan, Klinan 6, Maligo Barangays villages (Polomolok area, South Cotabato district, Region XII province)",,,,Km2,Flood,Flash flood,--,--,0,274,115,0,"",2011-0367,PH,Philippines,,,,,,,2493.56674985824,224143083707.403,,,,952,95277940,,350,46000
07,10,2011,07,10,2011,Philippines (the),PHL,"Bobuntogan village (Jasaan area, Misamis Oriental district, Region X province)",,,,Km2,Flood,Flash flood,--,--,0,185,0,0,"",2011-0380,PH,Philippines,,,,,,,2493.56674985824,224143083707.403,,,,952,95277940,,350,46000
14,11,2011,17,11,2011,Philippines (the),PHL,"Cagayan, Isabela districts (Region II province), Aurora district (Region III province), Capiz, Aklan districts (Region VI province)",,,,Km2,Flood,Riverine flood,"Slide (land, mud, snow, rock)",--,5,16191,183,0,"",2011-0468,PH,Philippines,,,,,,,2493.56674985824,224143083707.403,,,,952,95277940,,350,46000
09,11,2011,14,11,2011,Philippines (the),PHL,"Carmen, Braulio E. Dujali areas (Davao del Norte district, Region XI province)",8.085,125.93,3076,Km2,Flood,Flash flood,--,--,0,8610,178881,0,"",2011-0469,PH,Philippines,,,,,,,2493.56674985824,224143083707.403,,,,952,95277940,,350,46000
25,12,2011,28,12,2011,Philippines (the),PHL,"Catanduanes district (Region V (Bicol) province), Aklan, Capiz, Negros Occidental districts (Region VI (Western Visayas) province), Cebu district (Region VII (Central Visayas) province), Leyte, Southern Leyte districts (Region VIII (Eastern Visayas) province), Bukidnon district (Region X (Northern Mindanao) province), Compostela, Davao del Norte district (Region XI (Davao Region) province), Agusan del Sur, Dinagat, Surigao del Norte, Surigao del Sur districts (Region XIII (Caraga) province)",,,,Km2,Flood,Riverine flood,--,--,12,171809,0,0,"",2011-0540,PH,Philippines,,,,,,,2493.56674985824,224143083707.403,,,,952,95277940,,350,46000
21,12,2011,21,12,2011,Philippines (the),PHL,"Casiguran, Dilasag areas (Aurora district, Region III), Isabela, Cagayan districts (Region II province)",,,,Km2,Flood,Riverine flood,--,--,10,39520,0,0,"",2011-0542,PH,Philippines,,,,,,,2493.56674985824,224143083707.403,,,,952,95277940,,350,46000
05,05,2011,05,05,2011,Philippines (the),PHL,"Enrique B. Magalona, Victorias City areas (Negros Occidental district (Region VI province)",,,,Km2,Flood,Flash flood,--,--,0,30858,0,0,"",2011-0562,PH,Philippines,,,,,,,2493.56674985824,224143083707.403,,,,952,95277940,,350,46000
20,07,2011,20,07,2011,Philippines (the),PHL,"Zamboanga city (Zamboanga Del Sur district, Region IX province)",,,,Km2,Flood,Flash flood,--,--,0,469,0,0,"",2011-0588,PH,Philippines,,,,,,,2493.56674985824,224143083707.403,,,,952,95277940,,350,46000
31,03,2011,31,03,2011,Philippines (the),PHL,Compostela district (Region XI province),,,,Km2,Flood,Flash flood,"Slide (land, mud, snow, rock)",--,2,871,0,0,"",2011-0592,PH,Philippines,,,,,,,2493.56674985824,224143083707.403,,,,952,95277940,,350,46000
17,01,2012,17,01,2012,Philippines (the),PHL,"Agusan del Sur, Surigao del Sur districts (Region XIII province), Leyte district (Region VIII province), Compostela, Davao del Norte districts (Region XI province), Negros Occidental district (Region VI province), Region IV province",,,,Km2,Flood,Riverine flood,--,--,4,88570,0,0,"",2012-0009,PH,Philippines,,,,,,,2799.77965339004,250092092997.8,,,,986,96866642,,295,
14,02,2012,16,02,2012,Philippines (the),PHL,"Jabonga area (Agusan del Norte district, Region XIII province), Kauswagan and Bacolod areas (Lanao del Norte district, Region X province)",,,,Km2,Flood,Riverine flood,--,--,0,569,0,0,"",2012-0042,PH,Philippines,,,,,,,2799.77965339004,250092092997.8,,,,986,96866642,,295,
20,02,2012,27,02,2012,Philippines (the),PHL,"Lambayong area (Sultan Kudarat district, Region XII province), Agusan del Norte, Surigao del Norte districts (Region XIII province)",8.22392,125.27,39825.28,Km2,Flood,Riverine flood,--,--,0,25000,0,0,"",2012-0078,PH,Philippines,,,,,,,2799.77965339004,250092092997.8,,,,986,96866642,,295,
11,06,2012,11,06,2012,Philippines (the),PHL,"Kalamansig area (Sultan Kudarat district, Region XII province)",,,,Km2,Flood,Flash flood,--,--,0,12300,0,0,"",2012-0171,PH,Philippines,,,,,,,2799.77965339004,250092092997.8,,,,986,96866642,,295,
09,06,2012,12,06,2012,Philippines (the),PHL,"Glen area (Saranggani district, Region XII province), Maguindanao district (ARMM province), North Cotabato, Sultan Kudarat districts (Region XII province)",6.873,124.78,23515.69,Km2,Flood,Flash flood,--,--,1,700,0,0,"",2012-0172,PH,Philippines,,,,,,,2799.77965339004,250092092997.8,,,,986,96866642,,295,
06,08,2012,08,08,2012,Philippines (the),PHL,"Metropolitan Manila district (National Capital region (NCR) province), Ilocos Sur, La Union, Pangasinan districts (Region I (Ilocos Region) province), Bataan, Bulacan, Nueva Ecija, Pampanga, Tarlac, Zambales districts (Region III (Central Luzon) province), Batangas, Cavite, Laguna, Rizal districts (Region IV-A (Calabarzon) province), Mindoro Occidental, Mindoro Oriental districts (Region IV (Southern Tagalog) province), Iloilo district (Region VI (Western Visayas) province)",,,,Km2,Flood,Riverine flood,--,--,112,4451725,72330,3000,"",2012-0272,PH,Philippines,,,,,,,2799.77965339004,250092092997.8,,,,986,96866642,,295,
27,03,2012,27,03,2012,Philippines (the),PHL,Region VI (Western Visayas) province,,,,Km2,Flood,Riverine flood,--,--,11,4835,2000,0,"",2012-0396,PH,Philippines,,,,,,,2799.77965339004,250092092997.8,,,,986,96866642,,295,
12,06,2012,13,06,2012,Philippines (the),PHL,"Region XIII (Caraga), Autonomous region in Muslim Mindanao (ARMM), Region IX (Zamboanga Peninsula), Region X (Northern Mindanao), Region XI (Davao Region), Region XII (Soccsksargen) provinces",,,,Km2,Flood,Riverine flood,--,--,29,30929,1000,0,"",2012-0602,PH,Philippines,,,,,,,2799.77965339004,250092092997.8,,,,986,96866642,,295,
15,01,2013,23,01,2013,Philippines (the),PHL,Region X (Northen Mindanao) province,,,,Km2,Flood,Flash flood,"Slide (land, mud, snow, rock)",--,10,507769,2800,0,"",2013-0019,PH,Philippines,,,,,,,3036.39619199277,271836123724.555,,,,724,98481032,,514,116000
13,08,2013,21,08,2013,Philippines (the),PHL,"Region III (Central Luzon) province (Pampanga district (Lubao, Floridablanca, Minalin areas), Bulacan district (Meycauayan area), Nueva Ecija district (Mariveles, Bataan, Malolos City, Carranglan areas), Zambales district (Olongapo area), Tarlac, Bataan districts), 
Region IV-A (Calabarzon) province (Rizal district (Teresa, Binangonan areas), Cavite district (Imus, Bacoor, Kawit, Noveleta, Tanza areas), Quezon district (Sariaya area), Laguna district),
Region IV province (Mindoro Occidental district), 
National Capital region (NCR) province (Metropolitan Manila district (Las Pinas, Caloocan, Valenzuela, Navotas, Malabon areas)),
Region I (Ilocos region) province (Pagasinan district),
Cordillera Administrative region (CAR) province (Mountain Province district (Bontoc, Sagada areas), Benguet district (Tuba area), Abra district)",16.3191,121.14,50412.4,Km2,Flood,Riverine flood,"Slide (land, mud, snow, rock)",--,31,3096422,2190000,100000,"",2013-0274,PH,Philippines,,,,,,,3036.39619199277,271836123724.555,,,,724,98481032,,514,116000
01,08,2013,09,08,2013,Philippines (the),PHL,"Region XIII (Caraga), Autonomous region in Muslim Mindanao (ARMM), Region IX (Zamboanga Peninsula), Region X (Northern Mindanao), Region XI (Davao Region), Region XII (Soccsksargen) provinces
",,,,Km2,Flood,Riverine flood,"Slide (land, mud, snow, rock)",--,11,100021,36000,0,"",2013-0340,PH,Philippines,,,,,,,3036.39619199277,271836123724.555,,,,724,98481032,,514,116000
23,09,2013,27,09,2013,Philippines (the),PHL,"Olongapo City area (Zambales district, Region III (Central Luzon) province), Busuanga area (Palawan district, Region IV province)",,,,Km2,Flood,Riverine flood,--,--,33,588155,4000,0,"",2013-0418,PH,Philippines,,,,,,,3036.39619199277,271836123724.555,,,,724,98481032,,514,116000
04,10,2013,10,10,2013,Philippines (the),PHL,"Palawan district (Region IV province), ARMM, Region VI, Region VII, Region, VIII, Region IX, Region X, Region XI, Region XII, Region XIII provinces",,,,Km2,Flood,Riverine flood,Lightening,--,20,207971,1988,0,"",2013-0434,PH,Philippines,,,,,,,3036.39619199277,271836123724.555,,,,724,98481032,,514,116000
13,06,2014,03,07,2014,Philippines (the),PHL,"Maguindanao, Shariff Kabunsuan districts (ARMM province)",,,15356,Km2,Flood,Riverine flood,--,--,0,99185,0,0,"",2014-0250,PH,Philippines,,,,,,,3094.45667532401,284584522898.935,,,,670,100102249,,470,78000
30,08,2014,05,09,2014,Philippines (the),PHL,"El Salvador, Cagayan de Oro City, Lagonglong, Naauan, Opol areas (Misamis Oriental district, Region X province), Quezon area (Bukidnon district, Region X province)",,,,Km2,Flood,Flash flood,"Slide (land, mud, snow, rock)",--,4,3770,0,0,"",2014-0414,PH,Philippines,,,,,,,3094.45667532401,284584522898.935,,,,670,100102249,,470,78000
25,08,2014,01,09,2014,Philippines (the),PHL,"Kabacan, Tulunan, Pikit areas (North Cotabato district, Region XII province), Upi, So. Upi areas (Shariff Kabunsuan district, ARMM province), Maguindanao district (ARMM province)
",,,,Km2,Flood,--,"Slide (land, mud, snow, rock)",--,1,42175,0,0,"",2014-0571,PH,Philippines,,,,,,,3094.45667532401,284584522898.935,,,,670,100102249,,470,78000
02,07,2015,02,07,2015,Philippines (the),PHL,"Basilan, Tawi-tawi districts (ARMM province)",,,,Km2,Flood,--,Storm,--,8,122000,0,0,"",2015-0279,PH,Philippines,,,,,,,3182.53862065383,292774099014.19,,,,593,101716359,,572,62000
07,07,2015,10,07,2015,Philippines (the),PHL,"Caloocan, Malabon, Quezon City, Valenzuela City areas (Metropolitan Manila district, NCR province),Dinalpupihan, Mariveles areas (Bataan district, Region III province),Marilao, Meycauayan, San Jose Del Monte, Santa Maria areas (Bulacan district, Region III province), San Fernando area (Pampanga district, Region III province), Botolan, Candelaria, Masinloc areas (Zambales district, Region III province), San Jose area (Batangas district, Region IV-A province), San Pedro area (Laguna district, Region IV-A province), Conner, Kabugao areas (Apayao district, CAR province), Atok, Baguio City, Bangar, Itogon, Kapangan, Kibunga, La Trinidad, Sablan, Tuba areas (Benguet district, CAR province), Liwan, Tabuk areas (Kalinga district, CAR province)",,,,Km2,Flood,--,"Slide (land, mud, snow, rock)",--,23,42500,86,0,"",2015-0283,PH,Philippines,,,,,,,3182.53862065383,292774099014.19,,,,593,101716359,,572,62000
12,07,2015,21,07,2015,Philippines (the),PHL,Pangasinan province,15.5509,120.8,16151.08,Km2,Flood,--,--,--,4,3000,0,0,"",2015-0284,PH,Philippines,,,,,,,3182.53862065383,292774099014.19,,,,593,101716359,,572,62000
05,08,2015,05,08,2015,Philippines (the),PHL,"Malaybalay City, Valencia areas (Bukidnon district, Region X province)",,,,Km2,Flood,Riverine flood,--,--,9,880,0,0,"",2015-0323,PH,Philippines,,,,,,,3182.53862065383,292774099014.19,,,,593,101716359,,572,62000
30,07,2015,05,08,2015,Philippines (the),PHL,"Jagna area (Bohol district, Region VII (Central Visayas) province), Malaybalay city, Valencia areas (Bukidnon district, Region X (Northern Mindanao) province), Ampatuan, Datu Piang, Pagalungan areas (Maguindanao districts, ARMM province), Kabuntalan, Sultan Kudarat areas (Shariff Kabunsuan district, ARMM province)",,,,Km2,Flood,--,"Slide (land, mud, snow, rock)",--,9,62929,114,0,"",2015-0359,PH,Philippines,,,,,,,3182.53862065383,292774099014.19,,,,593,101716359,,572,62000
08,08,2016,16,08,2016,Philippines (the),PHL,"National Capital Region (NCR) province, Ilocos Sur, La Union, Pangasinan districts (Region I (Ilocos Region) province), Bataan, Bulacan, Nueva Ecija, Pampanga, Tarlac, Zambales districts (Region III (Central Luzon) province), Laguna, Rizal districts (Region IV-A (Calabarzon) province), Antique, Iloilo, Negros Occidental districts (Region VI (Western Visaya) province), Abra, Benguet, Ifugao, Mountain province districts (Cordillera Administrative region (CAR) province)",,,,Km2,Flood,--,--,--,26,1263098,9320,0,"",2016-0377,PH,Philippines,,,,,,,3255.4421565764,304889079564.681,,,,434,103320222,,550,87000
18,08,2016,22,08,2016,Philippines (the),PHL,"Pampanga district (Region III (Central Luzon) province), Pangasinan district (Region I (Ilocos region) province)",,,,Km2,Flood,--,--,--,19,1300000,0,0,"",2016-0445,PH,Philippines,,,,,,,3255.4421565764,304889079564.681,,,,434,103320222,,550,87000
16,01,2017,31,01,2017,Philippines (the),PHL,"Western Visayas, Central Visayas, Eastern Visayas, Zamboanga (Samboanga del Norte), Northern Mindanao (Bukidnon, Camiguin, Misamis Occidental, Misamis oriental, Lanao del Norte) Davao (Compostela, Davao del Norte, Davao del Sur, Davao Oriental), Caragan (Agusan del Norte, Agusan del Sur, Surigao del Norte), Autonomous region of Muslim Mindanao (Lanao del Sur, Maguindanao), Soccskargen (Saranggani)",,,,Km2,Flood,--,"Slide (land, mud, snow, rock)",--,9,1500000,8100,0,"",2017-0028,PH,Philippines,,,,,,,,313595208737.269,,,,433,104918090,,1620,445000
01,02,2017,07,02,2017,Philippines (the),PHL,"Mindanao (Agusan del Sur, Compostela Valley, Agusan del Norte, Davao Oriental, Lanao del Sur and Maguindanao)",7.59,124.062,30389.11,Km2,Flood,--,--,--,13,334000,0,0,"",2017-0226,PH,Philippines,,,,,,,,313595208737.269,,,,433,104918090,,1620,445000
22,09,2017,24,09,2017,Philippines (the),PHL,"Bacolod, Sipalay, Bago, Talisay, La Carlota, Hinobaan, Binalbagan, Pontevedra (Negros Occidental province-Western Visayas Region)
",10.566,123.171,10299.67,Km2,Flood,Flash flood,--,--,0,8000,0,0,"",2017-0497,PH,Philippines,,,,,,,,313595208737.269,,,,433,104918090,,1620,445000
13,01,2018,17,01,2018,Philippines (the),PHL,"Bicol, Dvao, Eastern Visayas, NOrthern Mindanao, Western Visayas",,,,Km2,Flood,--,--,--,11,180000,0,0,"",2018-0051,,,,,,,,,,,,,,,,,,
20,07,2001,03,08,2001,Poland,POL,"Malopolske, Swietokrzyskie, Donoslaskie, Oploskie, Slaskie, Warminsko-Mazurkie, Podlaskie province ;  Gdansk, Slupsk districts (Pomorskie province)",,,47890,Km2,Flood,Flash flood,--,--,27,15000,700000,30000,"",2001-0390,PL,Poland,,,,,,,4241.9655605523,190521263343.023,,,,3191,38248076,,,
27,07,2004,02,08,2004,Poland,POL,"Podkarpackie, Malopolske province",,,,Km2,Flood,Riverine flood,--,--,0,600,0,0,"",2004-0369,PL,Poland,,,,,,,5522.34437741339,255102252843.395,,,,10677,38182222,,,
17,03,2005,26,03,2005,Poland,POL,"Elk, Gizycko, Ketrzyn, Mragowo, Olecko districts (Warminsko-Mazurskie province) ; Dolnoslaskie province",,,110,Km2,Flood,Riverine flood,--,--,2,3600,0,0,"",2005-0131,PL,Poland,,,,,,,6761.96364084192,306125173852.573,,,,19641,38165445,,,
04,06,2006,06,06,2006,Poland,POL,"Nowy Sacz, Tarnow districts (Malopolske province)",49.5,20.93,27580,Km2,Flood,Riverine flood,--,--,0,500,0,0,"",2006-0302,PL,Poland,,,,,,,7587.19470972637,344748646558.391,,,,13513,38141267,,,
22,06,2009,26,06,2009,Poland,POL,"Kracow, Kracow I, Kracow II districts (Malopolske province) ; Dolnoslaskie, Opolskie, Slaskie provinces",,,,Km2,Flood,Riverine flood,--,--,1,150,100000,0,"",2009-0228,PL,Poland,,,,,0.0320171021577574,,9836.02392989634,439796160379.475,,,,2059,38151603,,,
17,05,2010,26,05,2010,Poland,POL,"Krakow district (Malapolske province), Warszawa district (Mazowieckje province) ; Slaskie, Podkarpackie, Opolskie, Swietokrizyskie, Malopolskie provinces",,,,Km2,Flood,Riverine flood,Broken Dam/Burst bank,--,16,100000,3080000,0,"",2010-0193,PL,Poland,,,,,,,10713.6438922405,479321460551.189,,,,1764,38042794,,,
07,08,2010,08,08,2010,Poland,POL,"Bogatynia, Zgorzelec-Görlitz villages (Zgorzelec district), Radomierzyce village (Wroclaw I district) (Dolno?l?skie province)",,,,Km2,Flood,Flash flood,Broken Dam/Burst bank,--,3,700,0,0,"",2010-0380,PL,Poland,,,,,,,10713.6438922405,479321460551.189,,,,1764,38042794,,,
28,05,2016,28,05,2016,Poland,POL,"Nowy Targ district (Mount Sokolica region, Malopolske province), Sucha Beskidzka district (Mount Babia Gora region, Malopolske province), Szcyrk city (Czechowice-Dziedzice district, Slaskie province)",,,,Km2,Flood,--,Lightening,--,2,3,0,0,"",2016-0179,PL,Poland,,,,,,,10463.1121805653,471400273917.013,,,,1159,37970087,,,
26,01,2001,29,01,2001,Portugal,PRT,Mesao Frio district (Vila Real province) and Seia district (Guarda province),,,10600,Km2,Flood,Riverine flood,"Slide (land, mud, snow, rock)",--,6,200,0,0,"",2001-0040,PT,Portugal,,,,,,,9670.36452054007,121545880984.34,,,,17,10362722,,,
26,12,2002,26,12,2002,Portugal,PRT,"Aveiro, Braga, Braganca, Guarda, Porto, Viana Do Castelo, Vila Real, Viseu province",,,0,Km2,Flood,Riverine flood,--,--,1,60,0,0,"",2002-0814,PT,Portugal,,,,,,,10623.2344869245,134228697534.35,,,,62,10419631,,,
01,01,2003,08,01,2003,Portugal,PRT,"Agueda, Anadia, Mealhada, Oliveira do Bairro districts (Aveiro province)",,,0,Km2,Flood,Riverine flood,"Slide (land, mud, snow, rock)",--,0,36,0,0,"",2003-0001,PT,Portugal,,,,,,,13038.8681744466,164964195259.594,38.7,,,55,10458821,,,
22,10,2006,08,11,2006,Portugal,PRT,Faro province,41.65,-7.87,,Km2,Flood,Riverine flood,"Slide (land, mud, snow, rock)",--,0,240,0,0,"",2006-0617,PT,Portugal,,,,,,,15948.5300604724,208566948939.907,38.1,,,25,10522288,,,
18,02,2008,18,02,2008,Portugal,PRT,"Loures, Sacavem cities (Loure district, Lisboa province), Setubal city (Setubal district, Setubal province)",,,,Km2,Flood,Riverine flood,"Slide (land, mud, snow, rock)",--,2,110,0,0,"",2008-0074,PT,Portugal,,,,,,,19679.4158052652,262007590449.685,36.6,,,36,10558177,,,
20,02,2010,21,02,2010,Portugal,PRT,Funchal district (Ilha Da Madera province),32.76,-16.97,483,Km2,Flood,Riverine flood,"Slide (land, mud, snow, rock)",Rain,43,618,1350000,70000,"",2010-0068,PT,Portugal,,,,,,,17884.2255085989,238303443425.21,35.8,,,30,10573100,,,
01,11,2015,03,11,2015,Portugal,PRT,Faro province,,,,Km2,Flood,Flash flood,--,--,1,0,0,0,"",2015-0532,PT,Portugal,,,,,,,15389.3209978553,199420256049.689,35.5,,,28,10358076,,,
06,05,2001,07,05,2001,Puerto Rico,PRI,"Yauco, Guayanilla districts (Mayaguez province)",,,245,Km2,Flood,Riverine flood,--,--,2,9480,146000,0,"",2001-0307,PR,Puerto Rico,,,,,,,,69208400000,,,,,3818774,,,
16,04,2003,22,04,2003,Puerto Rico,PRI,"Las Piedras, Rio Grande, Naguabo, Luquillo, Humacao, Juncos, Fajardo districts (Humacao province), Penuelas, Guanica districts (Mayaguez province)",,,,Km2,Flood,Riverine flood,"Slide (land, mud, snow, rock)",--,2,2405,0,0,"",2003-0238,PR,Puerto Rico,,,,,,,,74827400000,,,,,3826095,,,
23,05,2004,01,06,2004,Puerto Rico,PRI,San Juan province,,,,Km2,Flood,Riverine flood,--,--,0,0,0,0,"",2004-0231,PR,Puerto Rico,,,,,,,,80322313000,,,,,3826878,,,
03,11,2014,05,11,2014,Puerto Rico,PRI,"Aguadilla, Arecibo, Bayamon, Guayama, Humacao, Mayaguez, Ponce, San Juan provinces",,,,Km2,Flood,Flash flood,--,--,1,0,0,0,"",2014-0453,PR,Puerto Rico,,,,,,,,102445800000,,,,,3534874,,,
22,06,1999,16,07,1999,Romania,ROU,"",,,,Km2,Flood,Riverine flood,--,--,19,4671,10000,0,"",1999-0230,RO,Romania,,,,,,,1232.56679958914,36183003978.3474,,,,8558,22472040,,,
09,07,1999,16,07,1999,Romania,ROU,Northern and western,,,,Km2,Flood,Riverine flood,--,--,15,4362,50000,0,"",1999-0231,RO,Romania,,,,,,,1232.56679958914,36183003978.3474,,,,8558,22472040,,,
"",03,2000,"",03,2000,Romania,ROU,"Hunedoara, Maramures, Cluj, Mures, Bistrita Nasaud provinces",,,,Km2,Flood,Riverine flood,--,--,0,3000,500,0,"",2000-0167,RO,Romania,,,,,,,1289.15104530164,37438527799.5302,,,,7348,22442971,,,
05,04,2000,25,04,2000,Romania,ROU,"Alba, Arad, Bihor, Bistrita, Botosani, Brasov, Caras-Severin, Cluj, Harghita, Hunedoara, Mamamures, Mures, Olt, Satu-Mare, Salaj, Timis provinces",,,932,Km2,Flood,Riverine flood,--,--,9,60431,100000,0,"",2000-0187,RO,Romania,,,,,,,1289.15104530164,37438527799.5302,,,,7348,22442971,,,
04,03,2001,17,03,2001,Romania,ROU,"Bihor, Bistrita-Nasaud, Maramures, Satu-Mare, Suceava, Harghita, Cluj, Salaj, Hunedoara, Alba, Botosani provinces",,,124,Km2,Flood,Riverine flood,--,--,0,4000,15000,0,"",2001-0079,RO,Romania,,,,,,,1421.34914792484,40716836998.0386,,,,6052,22131970,,,
19,06,2001,22,06,2001,Romania,ROU,"Alba, Arges, Brasov, Bucuresti, Buzau, Calarasi, Covasna, Dimbovita, Dolj, Giurgiu, Gorj, Harghita, Ialomita, Mehedinti, Mures, Olt, Prahova, Sibiu, Teleorman, Vilcea provinces",,,14270,Km2,Flood,Riverine flood,--,--,7,10803,120000,0,"",2001-0288,RO,Romania,,,,,,,1421.34914792484,40716836998.0386,,,,6052,22131970,,,
19,07,2002,23,07,2002,Romania,ROU,"Constanta, Suceava, Prahova, Iasi, Vaslui provinces ",,,5420,Km2,Flood,Riverine flood,--,--,4,4500,0,0,"",2002-0447,RO,Romania,,,,,,,1591.75355431395,46174557555.5892,,,,8847,21730496,,,
